question,views,posted
Which university is better among LPU and Chandigarh university?,15,2 years ago
"Which is the best university for pursuing B.Tech in CSE, Manav Rachna, Chitkara University, LPU or Amity, Gurgaon?",395,2 years ago
Why Lovely Professional University considered as best private University?,30,2 years ago
"Is LPU, Punjab good for M.Sc biotechnology?",93,2 years ago
What is the Induction programme at LPU?,32,2 years ago
Is LPU is recognised by UGC?,58,2 years ago
Which university is better for B.Tech among LPU and ICFAI (Hyderabad)?,498,2 years ago
"Which is the best college for studies and placement after B.Tech CSE among LPU and SRM, Chennai?",18,2 years ago
"Do you offer 100% placements with assurance? If not, how many candidate were placed in the previous batch?",36,2 years ago
Is LPU good for BJMC course?,89,2 years ago
I have 58 % in 12th cbse can i get admission  in bcom hons  I have 6 sub in 12 th my top 4 sub % is 72,25,2 years ago
"Which University is better for B.Tech, Chandigarh University or LPU?",45,2 years ago
LPU vs PSIT Kanpur which is better for ECE.,227,2 years ago
What is the difference between LPU and other private universities? Why LPU has higher fee structure?,182,2 years ago
Is LPU a good college for nutrition and dietetics?,20,2 years ago
What type of jobs are offered as placement to the students who completed B.Des (product design) from LPU?,64,2 years ago
"Which institute is better among LPU and SRKR, Chennai?",43,2 years ago
Can anybody enlighten the most recent innovation by LPUs scientist in the field of Bio Engineering & Bio-Sciences?,18,2 years ago
How is the MBA program in the college and how are the overall placements in the college?,106,2 years ago
Is BBA in international finance good from LPU?,38,2 years ago
"Which one is better for B.Tech (CS) among LPU, NSIT and DTU?",914,2 years ago
Which one is better among LPU & Sharda University for B.Tech in CSE?,549,2 years ago
How many students are living in hostels?,30,2 years ago
Which one will be the best for B.Tech ECE among LPU and G.L Bajaj?,398,2 years ago
"Which college is better for pursuing mass communication, Chandigarh University or Lovely Professional University?",113,2 years ago
"Is it okay to opt for LPU for MBA? What about its placements, hostel charges and exposure to corporate world?",93,2 years ago
What are the reviews of those studying B.Tech in mechanical at LPU?,48,2 years ago
Do lateral entry student's get good placements as per past records?,66,2 years ago
Comparison between lpu and Amity on placement bases,246,2 years ago
What about social distancing at LPU?,12,2 years ago
"Which university is best for MBA among LPU, Galgotia University, GLAU, Thapar university and Sharda university?",295,2 years ago
Does LPU offer NCC for its students?,28,2 years ago
Which one is good among LPU and CGC for B.Tech in CSE?,193,2 years ago
Which is a better college to pursue B.Tech CSE among Chandigarh University and LPU?,119,2 years ago
"Which university is best for MBA among LPU, Galgotia University, GLAU, Thapar university and Sharda university?",38,2 years ago
"Which college is best for MBA among LPU Punjab, MET Mumbai, IES Mumbai, Chetana Mumbai, and Christ Bangalore?",54,2 years ago
Which one is good for a B.A. LL.B. Sharda University or LPU?,22,2 years ago
"Which college is better among Vel Tech, Chennai and LPU?",230,2 years ago
Which university provides better internship opportunity VIT or LPU?,14,2 years ago
How much marks should I required in 12th maths commerce to eligible for B.Com (Hons) course.,26,2 years ago
"Which is better college for CSE: LPU or MBM, Jodhpur? In which round seats for CSE in MBM completely filled?",177,2 years ago
What is the mess fee of LPU?,3900,2 years ago
Should I opt for B.Tech in LPU or pursue B.Sc from DU?,199,2 years ago
"Which college is better for CSE among Galgotias, Graphic Era and LPU?",69,2 years ago
"I want to take admission in MBA at LPU, I want to know about placements of MBA course?",316,2 years ago
Which is best for MBA among LPU and Amity?,130,2 years ago
"Which one is better for Mechanical engineering: VIT, SRM, LPU or Manipal?",148,2 years ago
"Which college is better to pursue CSE: KIITS, LPU, SRM, Sathyabhama University, Dayanand or PES?",16,2 years ago
How is campus selection at LPU?,314,2 years ago
Which university is best for journalism between LPU and MSU?,87,2 years ago
I completed my B.E (Mechanical Engineering) a month ago. I want to start my M.Tech in automobile engineering. Can I do M.Tech from LPU?,110,2 years ago
Which institute shall I choose among Oriental Institute of Science and Technology and LPU?,84,2 years ago
Do you think LPU is of that rating where I can compare it with Foreign Universities to pursue Higher education? Corona sinks my study visa.,10,2 years ago
How is lpu for b.tech in cse?,290,2 years ago
"Which is the best university for B.Tech in CSE among LPU, Galgotias and Amity?",275,2 years ago
Which is a better option among LPU and Manipal University?,1900,2 years ago
"Which will be best for B.Tech CSE among LPU, Presidency University and Acharya Institute of Technology?",369,2 years ago
Which is better for CSE- KIIT or LPU?,79,2 years ago
Which is better among SRM and LPU in all means?,23,2 years ago
Is it a good choice to pursue CSE from LPU? Will I get a good job and high salary package after completing CSE from LPU?,84,2 years ago
Is Lovely professional University good for MBA?,265,2 years ago
What are the specialisation available in B.Tech. CSE (Hons. ). Programme in LPU? What's the Eligibility & Placement Record?,24,2 years ago
How are the placements in LPU and Manipal?,31,2 years ago
Which one is better for CSE among IEM-Kolkata and LPU?,92,2 years ago
"For MBA marketing, which college is better: LPU, CGC and CU?",25,2 years ago
Is MS ramaiah better than LPU?,566,2 years ago
Which one is best for MBA: Doon Business School or LPU?,58,2 years ago
I came to know that LPU has ICAR accreditation upto March 2023. So I wish to know whether it will extend or not after this.,832,2 years ago
"Which will be best for B.Tech CSE among LPU, Presidency University and Acharya Institute of Technology?",56,2 years ago
"Which college is better amongst LPU, Thapar and SRM for B.Tech in computer Science engineering?",44,2 years ago
Which institute is better for BBA among ITM and LPU?,74,2 years ago
Which is better for fashion design: Amity University or LPU?,66,2 years ago
Is this a good college for MBA? How is its placement and what is the average package offered for the same? How is the college environment?,279,2 years ago
"Which college is better for B.Sc. Agriculture in Amity University, Noida or LPU, Jalandhar?",62,2 years ago
Which is better for CSE: LPU or NIT Srinagar/Manipur/Meghalaya or Sikkim Agartala?,13,2 years ago
Does LPU have any option of pathway programs with Canadian universities for B.Tech?,342,2 years ago
Which college is better among Lovely Professional University and Dronacharaya College of Engineering?,69,2 years ago
Does AIFD has a better fashion design course than LPU? Which college has high fees?,40,2 years ago
I am confused about taking admission in LPU or SRM for CSE. As I SEE that SRM is very expensive then LPU and I also got scholarship in LPU.,20,2 years ago
I am confuse between two colleges for b.tech CS please give me suggestion  which is best for b.tech between LPU and Coer roorkee,91,2 years ago
Is srm good or lpu good for CSE.,125,2 years ago
Is KIIT IT branch better or LPU CSE?,28,2 years ago
Which is the best university for me? I have scored 85% in class 12th.,47,2 years ago
Which is the best option for BBA among Birla Institute and LPU?,273,2 years ago
Which college is better for B.Tech LPU or MMM?,140,2 years ago
"Which one is good for CS: LPU or DAV, Jalandhar?",159,2 years ago
Which college is better for BBA among Amity or LPU?,82,2 years ago
How is the placement record (maximum and minimum) of Lovely Professional University?,57,2 years ago
How is LPU for engineering?,119,2 years ago
How is LPU for pursuing computer science?,316,2 years ago
Which is the best college for B.Tech among Galgotias and LPU?,110,2 years ago
How is TMU compared to LPU University?,183,2 years ago
"Which is the best university to pursue B.Tech, LPU or SASTRA University?",159,2 years ago
"Which college is best among Christ, Doon Business School and Lovely Professional University for B.Com?",200,2 years ago
"Which among LPU, Chandigarh University and Chandigarh Group of Colleges is better for BBA?",148,2 years ago
Which college is better: KIIT or Lovely Professional University?,902,2 years ago
Which institute is better for B.Tech in CSE among RIMT University and LPU?,333,2 years ago
Is it beneficial to pursue LL. M. from LPU rather than from any Law school?,46,2 years ago
Which one will be better for agricultural science undergraduate program: Lovely Professional University or University of Queensland?,85,2 years ago
How is the lab facilities of LPU? How are the equipments?,28,2 years ago
Should I go for LPU if they provide me a scholarship of 80000 per year to pursue B.Tech CS?,71,2 years ago
"Which university is better, Amity University, Kolkata or LPU?",47,2 years ago
Which is better among Amity and LPU for MBA in finance?,153,2 years ago
Which is a better college among LPU and Galgotia for B.Tech in computer science?,295,2 years ago
Which is better college LPU or JIMS ROHINI.,288,2 years ago
Is LPU good to pursue B.Tech in automobile engineering?,172,2 years ago
"Which one is better among RVCE, Bangalore, LPU and SGSITS, Indore for CSE?",735,2 years ago
Is LPU best option for MBA?,247,2 years ago
ECE is better at LPU or at CU?,120,2 years ago
Fee structure of Lovely professional University?,95,2 years ago
Which is better for B.J. M. C. banasthali vidyapith or lpu?,93,2 years ago
What about B.Tech CSE in LPU?,239,2 years ago
WHICH INSTITUTION WILL BE BEST TO STUDY PGDM OR MBA 1. GJU HISAR 2. DAV COLLEGE CHD 3. KU UNI. 4. LPU 5. MAU HIMACHAL . PLEASE TELL ME .,223,2 years ago
Which college is better for B.Tech in CSE among LPU and Manipal University?,99,2 years ago
"Gl bajaj, lpu or chitkara university for CSE, which one is better?",32,2 years ago
Which college should I join for b.tech from c.s. galgotia university or college or lovely professional university or gla mathura,187,2 years ago
How are the labs facilities of LPU for Microbiology?,45,2 years ago
"Which one to choose among NIT, Srinagar for mechanical engineering and LPU for CSE?",73,2 years ago
"Which is the best university for CSE among LPU-Jalandhar and DIT-Dehradun in terms of faculty, placement and exposure?",215,2 years ago
"Which college is better among MIT, Pune and LPU?",68,2 years ago
Which MBA school will be better for me: LM Thapar School of Management or LPU or Mittal School of Business?,53,2 years ago
Which college is better between LPU and UPES for B.Tech in CSE?,30,2 years ago
Pl suggest which is better for B.Tech CSE upes or lpu or ncu.,61,2 years ago
"Which is the best college for ECE among Nirma University, LPU and Galgotias?",104,2 years ago
Is Lovely Professional University a good choice for engineering?,830,2 years ago
Which is the best university to pursue CSE among LPU and Saveetha University?,262,2 years ago
What are the marks required for getting CSE in LPU?,11,2 years ago
Which university should I prefer for B.Tech in CSE among Christ University and Lovely Professional University?,263,2 years ago
How about pursuing B.Des in multimedia design from LPU?,160,2 years ago
Can anyone get admission for B.Tech in CSE in LPU through LPUNEST exam? Can I crack LPUNEST with EAMCET level preparation?,349,2 years ago
How can I take CS branch in LPU and on what basis branch is decided?,77,2 years ago
"Which is a better option among LPU and Acharya Institute of Technology, Bangalore?",423,2 years ago
Can I pursue BCA from this college after 12th? I am weak in maths but my computers is strong.,234,2 years ago
Will LPU be the best option for B.Tech?,306,2 years ago
Is Chandigarh University good for aerospace or should I choose LPU or Hindustan University?,44,2 years ago
Is Chandigarh University better than LPU?,32,2 years ago
"Which college should I go for B.Tech CSE? I am confused between LPU, Amity and Graphic Era.",45,2 years ago
Admission procedure for lpu.,75,2 years ago
Which is the best college for placements among UPES and LPU?,47,2 years ago
When can I apply for BBA course in LPU Jalandhar? I am doing 12th this year from UP board. Did 10th from ICSE.,41,2 years ago
Which institute is better for pursuing Bachelors in Information Technology: LPU or CU?,140,2 years ago
Is LPU good or bad for aerospace engineering?,45,2 years ago
What's the major difference between a B.Tech and a B.Tech hons at LPU? Which one should I take?,8,2 years ago
Shall I do BA honors in arts from BHU or BBA honors from LPU?,149,2 years ago
Which one is better for fashion designing: LPU or Symbiosis Institute of Design?,508,2 years ago
"Which is a better university to pursue CSE, Amity University-Noida or LPU?",36,2 years ago
What is the option that NCC student is having in the future if study from LPU?,57,2 years ago
"Sir, tell me about the fee for SC candidate for B.Tech in aerospace engineering in LPU, Jalandhar.",90,2 years ago
"Which university is better for B.Tech CSE amongst Galgotias, LPU, Bhartiya Vidyapeeth-Pune, UPES-Dehradun and UPTU?",68,2 years ago
"Which is best for CSE: NIT, Sikkim or LPU?",382,2 years ago
Which subjects should I choose in B.Com? How can I take admission LPU? WHat is the fee structure of the course?,57,2 years ago
What are the advantages/dis-advantages of pursuing B.Tech in IT from Lovely Professional University? How is the campus life?,93,2 years ago
"Is there any chance to get a job in abroad, if I complete mechatronic engineering from LPU?",231,2 years ago
Which one should I choose among LPU and Parul for CSE?,135,2 years ago
Can I get admission in B.Des in fashion designing at LPU after completion of graduation in other discipline?,264,2 years ago
"Which university is better for mechanical engineering among LPU, SRM and SASTRA?",159,2 years ago
Which is better in terms of study and placement LPU or Chandigarh university?,31,2 years ago
Am I eligible to take admission in LPU university if I scored 60% in 12th?,26,2 years ago
"Sir, I have completed inter with BIPC stream. Can I join in B.Arch?",224,2 years ago
Is LPU a good college for CSE or is there any good college in Rajasthan better than LPU in which I can get admission?,35,2 years ago
Which is the better option for MBA: CU or LPU?,73,2 years ago
How are the placements in CS in LPU as compared to CSE in SRM?,8,2 years ago
"Which is the best university to pursue CSE, LPU or Sahara University?",102,2 years ago
Which college is better for CSC: SRM or LPU?,210,2 years ago
How is lovely professional university for BBA.,70,2 years ago
"Can I get admission in LPU, Punjab with 68% marks in BSEB board?",147,2 years ago
Which is best college SRKR or LPU?,229,2 years ago
What is the Eligibility criteria to join MBA at LPU?,41,2 years ago
"Which is a better college to pursue MBA in IB, RIIM or LPU? What is the fee structure of MBA in LPU?",109,2 years ago
LPU vs PSIT Kanpur which is better for ECE.,18,2 years ago
Which one should I prefer for B.Com Christ University or Lovely Professional University and why?,61,2 years ago
Which one is good among LPU and DY Patil University?,42,2 years ago
Should I opt for CSE in LPU or pursue B.Tech in IT from Oriental Institute of Science and Technology?,49,2 years ago
How can I get admission in LPU?,10,2 years ago
"Which is best for CSE: NIIT, Rajasthan or LPU, Jalandhar?",38,2 years ago
"Which is better among SKCET, Coimbatore and Lovely Professional University?",120,2 years ago
"Which one is better for B.Pharma among LPU, Sharda and Amity University?",46,2 years ago
Which one is better among Galgotias University and Lovely Professional University?,45,2 years ago
"Which college is better for B.Tech in CSE among LPU and Singhad Colleg, Pune?",110,2 years ago
"Is LPU better than IIT, Roorkee or not?",595,2 years ago
How is computer science engineering at Lovely Professional University?,121,2 years ago
"Which college is better for CS among PICT, MIT Pune, LPU and KIITS?",251,2 years ago
"Which college is better among LPU, VIT, Manipal, AMITY, SRM, KIIT and BITSAT?",1600,2 years ago
How about doing product design from LPU?,66,2 years ago
How was your experience studying at LPU?,119,2 years ago
I am about to start B.Tech from LPU. Can I get a good placement?,24,2 years ago
From where should I do B.Com LL.B: LPU or CT Group of Institutions because I could not pass LPU-NEST for Law?,408,2 years ago
"Among VIT, LPU, Saveetha Engineering College which is good for B.Tech in CSE? I have 94% in intermediate.",361,2 years ago
"Which one is better for B.Pharma among LPU, Sharda and Amity University?",31,2 years ago
"Which one is best for B.Tech CSE among LPU, Galgotia's and NIET?",188,2 years ago
What is the starting salary package of a mechanical engineering graduate of LPU?,42,2 years ago
"Which one is better for mechanical engineering between Chandigarh university, thapar, bml munjal, mit, and lpu?",13,2 years ago
Which university should I choose for petroleum engineering LPU or UPES?,11,2 years ago
"Which college is better for a B.Tech in IT, SRMCEM Lucknow or LPU Phagwara?",50,2 years ago
"Which is better among LPU and Manipal, Jaipur (I am getting a scholarship in LPU)?",121,2 years ago
I need detailed information about the course Diploma in architectural assistantship in Lovely Professional University?,98,2 years ago
Which is a better college to pursue CSE among LPU and BM Institute of Engineering and Technology (GGSIPU)?,62,2 years ago
Which is the best campus among VIT and LPU in all aspects? Please elaborate.,13,2 years ago
Which university is best for journalism between LPU and MSU?,57,2 years ago
"Hello everyone Please guys tell me about this college, how is the placements. Is it a good college for MBA.",59,2 years ago
Which college is better among SRM or LPU for CSE ?,823,2 years ago
"Which college should I prefer among LPU, NIT-Agartala and Assam University?",270,2 years ago
Which university has good placements: SRM or LPU?,12,2 years ago
"Which is a better college for BBA among Amity, Jaipur and LPU in terms of placement?",286,2 years ago
"Which is the best college among LPU & HBTU, Kanpur?",143,2 years ago
I got CGPA 9.82 and I got 78.55 JEE Mains score. Am I eligible for CSE at LPU?,29,2 years ago
Which private university is best for B.Tech Computer Science. LPU or VIT or SRM or Chandigarh University.,9,2 years ago
Does LPU has aerospace or aeronautical as a branch of engineering? What is the fees there?,37,2 years ago
Which one is better? Thapar or LPU? In placements.,11,2 years ago
Is LPU the best place to pursue B.Tech in CSE in terms of placement?,73,2 years ago
"Which Institute is good for graduation in Sciences, Miranda House, DU or LPU?",46,2 years ago
How is Lovely Professional University for pursuing B.Sc. (Hons) in Agriculture?,35,2 years ago
Which one is better among KIIT and LPU for CS?,168,2 years ago
LPU OR SATYABAMA OR GITAMS OR TOP 10 collages in eamcet  Which is best university to study csc bteck ?,338,2 years ago
Which is a better option among LPU and Manav Rachna for B.Tech in CSE?,82,2 years ago
What is the average and highest package offered?,1200,2 years ago
What are the different types of Course work options available at LPU for Ph.D. Part time.,61,2 years ago
Is LPU good for B.Tech computer science?,80,2 years ago
"Which is a better college to pursue CSE, BMS College-Bangalore or LPU?",157,2 years ago
Which college is best for placement: LPU or Banasthali or SASTRA University? I got 3592 rank in LPU-NEST 2018.,426,2 years ago
Should I opt for MBA in any of the top 30 B-schools or pursue CA?,8,2 years ago
Can anyone tell me about which to choose among these colleges for btech -- chandigarh university( mohali ) or chitkara or lpu,69,2 years ago
Is math is compulsory in lovely Profesnal university for BBA.,28,2 years ago
Is Lovely Professional University better than the government colleges of Uttarakhand?,137,2 years ago
"Which one is better for BBA among Chandigarh University, LPU and Amity University?",14,2 years ago
"Which one is good, UPES School of Business or Mittal School of Business in LPU?",71,2 years ago
"Which college is better among MS Ramaih, LPU, UPES Dehradun and Galgotias?",203,2 years ago
Which university is better among Lovely Professional University & Guru Jambeshwar University for B.Tech?,85,2 years ago
"Which is the best college to pursue MBA in marketing among JK business school, M.S.Ramaiah and LPU?",384,2 years ago
"Which is the best college, SRM, LPU, Amity or BITS?",208,2 years ago
Is LPU good for placement in computer science?,126,2 years ago
"Which is a better college to pursue CSE, LPU or DAVIET?",293,2 years ago
How is LPU for pursuing B.Tech in CSE?,86,2 years ago
Is LPU a good choice for civil engineering or not after completing Diploma?,104,2 years ago
How is Psychology course at LPU?,26,2 years ago
Which university is better among UPES and LPU?,86,2 years ago
Is it worth to pursue mechanical engineering from LPU? Which companies come for campus recruitment?,109,2 years ago
Which is the best field in B.Tech?,7,2 years ago
Which institute is better for pursuing CSE: LPU or MIT?,71,2 years ago
How will it be to do automobile engineering from Lovely Professional University?,58,2 years ago
What are the charges of hostel?,15,2 years ago
How is LPU for pursuing BBA?,86,2 years ago
"Which is the best option for B.Tech among Lovely Professional University, Sharda University, and Chandigarh University?",366,2 years ago
Is LPU a good college for fashion design?,234,2 years ago
"Which is overall best clg for MBA, IMED pune,LPU panjab, IPS jaipur,yashaswi IIMS pune, or any other",234,2 years ago
"I have 94% in intermediate, then how many marks are required to get CSE in LPU University?",392,2 years ago
I wan to join in LPU. CSE. Is it good?,39,2 years ago
Is Lovely Professional University a good choice for pursuing B.Tech CSE?,82,2 years ago
"Should I go for LPU, Amity or Alliance? I have done M.Com and want to do MBA in international business.",129,2 years ago
"Which college is better for B.Tech (CSE) among Dayanand Sagar, LPU and Sathyabhama?",135,2 years ago
Which is a better option among LPU and CBIT for CSE?,357,2 years ago
How is LPU to take admission in B.Tech CSE? Is it worth it for build up concept and also help to crack placement?,46,2 years ago
How is LPU and Oriental Institute of Science and Technology for ECE branch?,42,2 years ago
"I need some help with admissions in LPU University, Punjab.",74,2 years ago
What is the scope of placement after pursuing BBA from LPU?,168,2 years ago
Which institute is better for pursuing computer science engineering: Galgotias Chandigarh or LPU?,117,2 years ago
How is LPU better than CU in CSE?,29,2 years ago
Which college is best for B.Com: LPU or Poornima University?,60,2 years ago
"Which college is better among NIST, Berhampur and LPU, Jalandhar?",602,2 years ago
Which college is better for MBA among Galgotias and LPU?,129,2 years ago
Is LPU good for computer science engineering?,138,2 years ago
Which is the best college among LPU and Chandigarh University?,46,2 years ago
"Which one is better among PIMR, Indore and LPU for MBA?",464,2 years ago
Is Lovely Professional University a recognized university in Nepal?,59,2 years ago
Can I get admission in LPU in BTech with computer science (hons)?,79,2 years ago
"Is it good to move to Chandigarh or Jaipur for colleges like CGC, Jhanjeri, LPU and CU to pursue B.Tech in CSE in terms of placements?",216,2 years ago
Is there any course available in HR? I want to specialize in HRM(Human Resource Management).,121,2 years ago
Hii my name is pavan I am from Andhra Pradesh I got 86percent in inter+2 can I get a free seat in lpu university Punjab.,79,2 years ago
"Where should I go for B.Tech in computer Science engineering, upes, lpu or jaypee Noida sec.62.",11,2 years ago
I want to pursue agriculture Honours. Can I pursue it from LPU? Does it have good job aspects in the same field?,50,2 years ago
I got 51% in B.Com. Can I join MBA with MAT examination in Lovely Professional University?,209,2 years ago
I got 46 marks in JEE Mains and I belong to ST category. Can I apply for LPU?,69,2 years ago
How are the placement in lpu mechatronics engineering.,70,2 years ago
What are the placement records in automobile engineering?,58,2 years ago
I wish to join LPU for B.Sc maths. I am from commerce background in 12th & scored 94.9%. What is the fee structure from A to Z in LPU?,119,2 years ago
"Do we have a dual specialization or a dual degree in MBA?  Can we do 2 specializations like HR, IT or IT, Marketing in MBA from LPU?",123,2 years ago
Is Lovely Professional University better than National Law University for doing law?,244,2 years ago
"Which university is better for B.Tech in ECE among LPU, Punjab and JK Lakshmipat University, Jaipur?",308,2 years ago
Which one is better for B.Tech among SASTRA University and LPU?,228,2 years ago
Which one to choose for B.Tech lateral entry in civil engineering Jain University or LPU? I am confused help me choose the right college.,257,2 years ago
"Which is the best university to pursue B.Tech, LPU or Amity, Jaipur?",49,2 years ago
Which is a better option between Maharaja Agrasen Institute of Technology and Lovely Professional University for B.Tech in CSE?,165,2 years ago
"Which college is better for pursuing B.Tech in CSE, Galgotia or LPU?",256,2 years ago
Is it a good choice to pursue CSE from LPU?,138,2 years ago
Should I join B.Tech civil in LPU? Is it a right choice? Am I eligible to apply for government job after completing degree? Please help me.,94,2 years ago
