question,views,posted
Which one is best for computer Science engineering: LPU or DIT?,68,2 years ago
"I have scored 58% in 12th PCB, can I apply for agriculture course in LPU?",41,2 years ago
I got 89% in 10+2. Can you tell me about the scholarship to get admission in your university?,44,2 years ago
How can an agriculture degree be helpful?,48,2 years ago
Which are the best colleges offering lateral entry admission for B.Tech in automobile engineering?,6,2 years ago
Is it a good choice to pursue MBA from LPU?,176,2 years ago
"Which college is better among LPU and CGC, Landran to pursue hotel management?",58,2 years ago
Can I pursue BCA from this college after 12th? I am weak in maths but my computers is strong and I am an arts student.,240,2 years ago
Can we get job in government sector after getting agriculture degree from a private institution?,25,2 years ago
What is the last date to apply for BCA in Lovely Professional University?,39,2 years ago
"Which is the best university to do B.Tech CSE among Symbiosis International University, Pune and Lovely Professional University, Punjab?",169,2 years ago
Is it good to pursue B.Tech from LPU in terms for placements?,118,2 years ago
Is it worth to take admission in LPU?,60,2 years ago
Which are the best law colleges in Punjab with BBA LLB?,60,2 years ago
How is aerospace faculty at LPU?,9,2 years ago
Can I get the reviews for MCA course in LPU? How is the placement assistance there?,37,2 years ago
What is eligibility to join MBA in LPU?,58,2 years ago
Which college/university is best to pursue B.Tech in mechanical engineering in India?,27,2 years ago
What is specialty of Mechanical engineering programme at LPU? Do students get placed?,169,2 years ago
How is LPU for pursuing B.Tech in CSE?,62,2 years ago
Which one should I prefer for a T&T course: Lovely Professional University or Welcomgroup Graduate School Of Hotel Administration and why?,158,2 years ago
Which are the best colleges for fashion designing in India?,22,2 years ago
"'Which is the better institute for BHMCT out of these -Amritsar college of technology, GNDU, LPU?",23,2 years ago
Can someone give an honest review of LPU?,75,2 years ago
"Which is a better college among LPU, AKGEC and KIET for B.Tech in CSE?",31,2 years ago
How students of LPU are doing industrial training in this pandemic situation?,7,2 years ago
How much do I need to score to get admission in this college?,56,2 years ago
Is LPU better than Chandigarh University in terms of placements?,39,2 years ago
How to get admission in Lovely Professional University for B.Tech in EEE for a student from Kerala?,52,2 years ago
Can I get placement after completing BBA from LPU?,134,2 years ago
Can I get admission in LPU? What is its fee structure?,48,2 years ago
Am I eligible to pursue M.Sc. In biotechnology after completing B.Sc. Nursing?,30,2 years ago
Can I get admission in LPU?,21,2 years ago
Is LPU a good option for hotel management course?,105,2 years ago
Is B.Sc. Agriculture course of LPU ICAR approved at present?,19,2 years ago
How can I pursue B.Sc. In agriculture from Lovely Professional University? What is the admission procedure and eligibility criteria?,33,2 years ago
100% natural fruit flavoured chocolates - Researchers and Scientists of Lovely Professional University (LPU) made it possible - is this true,15,2 years ago
"Which university is better for B.Tech CSE amongst Galgotias, LPU, Bhartiya Vidyapeeth-Pune, UPES-Dehradun and UPTU?",34,2 years ago
What is the average salary package offered for CSE in this college?,85,2 years ago
How is B.Sc. Medical Lab Sciences at LPU?,57,2 years ago
What is the average package offered for CSE?,160,2 years ago
Do you have M.Arch courses?,109,2 years ago
"Which college is better to pursue CSE among KIIT, LPU and Galgotias?",26,2 years ago
"Which college is better for BBA amongst NCU, LPU and Sharda?",17,2 years ago
I have commerce stream in 12 without having maths. But I am thinking to get admission in BCA so plzz tell me that I am eligible or not.,42,2 years ago
Is choosing B.A LLB from LPU a good option?,183,2 years ago
I am thinking of joining LPU for fashion designing course. What to do?,35,2 years ago
How is LPU to pursue B.Tech information technology?,170,2 years ago
Can I pursue MBA from IPU? I am a B.Tech civil engineering.,116,2 years ago
Is it right to choose SRM or LPU for automobile engineering?,109,2 years ago
What is the global scope with high packages for students studying in B.A. Journalism & Mass Communication at LPU?,27,2 years ago
What about the placements in LPU after MBA? What about the salary package?,48,2 years ago
"Which is the best college to pursue MBA, LPU, ISBM, IILM or IMS?",331,2 years ago
How much marks do I need to score in my class 12th boards in order to pursue B.Sc. In agriculture from Lovely Professional university?,30,2 years ago
Which college is better: Birla or LPU?,20,2 years ago
"Is it a good choice to pursue law from Lovely Professional University, Jalandhar?",81,2 years ago
Which colleges is better among Amity Jaipur and LPU Jalandhar to pursue BBA?,179,2 years ago
"Is Lovely Professional University good for Bachelors in information technology? If not, which university is better?",76,2 years ago
"Suggest me better option for Engineering Chitkara, CT, Guru Kashi, Venkateshwara or LPU.",20,2 years ago
"Which is better, ECE in MUJ or CSE in LPU?",12,2 years ago
What are the scholarship options available in LPU apart from academics?,68,2 years ago
I got admission in LPU but can't afford its fees. Can you suggest a scholarship exam that I can write?,194,2 years ago
How is LPU (lovely professional university) for doing MBA?,115,2 years ago
Is internship provided in LPU for BBA (Hons. ). During the course period?,50,2 years ago
Which college is better for mechanical engineering among LPU and Amity University?,104,2 years ago
How is the quality of education in LPU for B.Tech CSE?,247,2 years ago
How is LPU better than CU in CSE?,16,2 years ago
What is the admission process for MCA in Lovely Professional University?,127,2 years ago
Is LPU a better choice for B.Tech ?,114,2 years ago
What is the procedure to get admission for CSE in LPU?,248,2 years ago
How is Economics course at LPU?,55,2 years ago
Is LPU good to pursue PhD?,31,2 years ago
Is it possible to get admission in LPU for an average student?,61,2 years ago
Is it a good choice to pursue B.Tech in CSE from LPU? How can I choose a good college for B.Tech in CSE?,113,2 years ago
What is the minimum package that an MBA student can get at the LPU?,12,2 years ago
What percentage is required for B.Tech in LPU?,124,2 years ago
"What is the required percentage to get admission in LPU, Jalandhar for BBA?",71,2 years ago
"Which is best for CSE: NIIT, Rajasthan or LPU, Jalandhar?",5,2 years ago
"Which is a better college to pursue BBA, Prestige-Indore or LPU? Can I pursue MBA abroad after completing BBA from the same?",179,2 years ago
Which is best for B.Tech in CSE - lpu\srm ramapuram\iimt greater Noida.,21,2 years ago
Which is a better option for electrical engineering among UPES and LPU?,66,2 years ago
Which is the better option for MBA: CU or LPU?,25,2 years ago
When will the admission start in LPU for fashion design?,25,2 years ago
"Which is better for pursuing mechanical engineering among DIT, Dehradun and LPU?",150,2 years ago
Is it good to pursue B.Tech from Manipal University or should I go for LPU?,237,2 years ago
Is LPU recognized by ICAR or not? I have completed my 12th standard.,59,2 years ago
Which is a better college to pursue B.Tech/BE in CSE among Galgotias and Chandigarh University?,10,2 years ago
Can I pursue M.Sc after completing B.Sc in agriculture from LPU? Can I apply for government jobs after completing my B.Sc in agriculture?,178,2 years ago
How is LPU for pursuing B.Tech in CSE?,82,2 years ago
Is LPU better for CSE than ECE as I just took admission in LPU for B.Tech Electronics and Computer Engineering?,75,2 years ago
"Can I know about LPU, Jalandhar?",76,2 years ago
"Which is a better university to pursue CSE, Amity University-Noida or LPU?",18,2 years ago
How can I get admission in LPU? What is the eligibility criteria for the same?,50,2 years ago
"Can you suggest an institute with good faculty, high placement and less fees for computer Science engineering?",36,2 years ago
"Which is the best college in Ludhiana, Punjab for B.Com?",25,2 years ago
How to prepare for successful interview?,5,2 years ago
Can I pursue computer science and engineering from LPU?,51,2 years ago
Can I get government job after completing B.Sc agriculture from Lovely Professional University?,287,2 years ago
"Which is best for CSE: LPU or NIT, Tadepalligudem?",6,2 years ago
"Which is the best college to pursue B.Tech in CSE, LPU, SRM or CGC?",11,2 years ago
Which is a better university to pursue BBA Amity University-Jaipur or LPU?,12,2 years ago
Can I get admission in LPU for B.Tech with 60 marks in JEE Mains and 74% marks in +2?,133,2 years ago
"Want to stay in Punjab, looking for B.Tech CSE. Chitkara or LPU? Which university is good.",12,2 years ago
I'm thinking about taking admission in LPU in B.Arch. Is it a good option or not?,53,2 years ago
"B.Sc. (Nutrition and Dietetics) from Cu, Chitkara or LPU?",51,2 years ago
How is Lovely Professional University to pursue Law ?,54,2 years ago
How is LPU to pursue MBA?,140,2 years ago
"How is LPU, Punjab for pursuing B.Tech in ME?",87,2 years ago
Can I get admission in LPU with 80 marks in JEE Mains? I belong to OBC category.,271,2 years ago
How is LPU to pursue MBA?,130,2 years ago
Should I pursue B.Tech in CSE from LPU or any other college?,161,2 years ago
From where should I pursue BBA among Lovely Professional University and from any college of Pune University?,123,2 years ago
Which is a better option for MBA among Lovely Professional University and Sharda University?,22,2 years ago
Can I take admission at LPU? Is it worth to pursue B.Tech in CCE from this college? How are the faculties? What is the placement record?,44,2 years ago
What is the difference between applying for BPT under applied science and BPT under physiotherapy course in LPU?,148,2 years ago
How is Lovely professional university for Hotel management?,110,2 years ago
How is LPU for pursuing computer Science?,10,2 years ago
"Which college is better among LPU, VIT, Manipal, AMITY, SRM, KIIT and BITSAT?",58,2 years ago
If the student wants to start his or her own setup then how LPU helps in this?,,2 years ago
Is it a good choice to pursue food technology from LPU?,131,2 years ago
I have 65% AGGREGATE marks in 12th from science stream And I have 46 marks in Mathematics. Will i get admission in b arch in lpu,72,2 years ago
Which one is best for computer Science engineering: LPU or DIT?,8,2 years ago
"Which college is better for BHM course among SBIHM, Kolkata and LPU, Punjab?",140,2 years ago
Is LPU a good choice for pursuing B.Tech?,79,2 years ago
Why would LPU be considered for engineering graduates.,13,2 years ago
"Which is a better university to pursue B.Tech, LPU, Chandigarh University and Punjab University?",225,2 years ago
Is LPU good for hospitality management?,107,2 years ago
How are the placements in LPU? LPU placements are being advertised. Anything special?,29,2 years ago
What about CSE in AI and ML at LPU with Upgrade? How is this course?,104,2 years ago
What is the syllabus of the entrance exam of fashion design of LPU?,318,2 years ago
What is the required score to get admission in LPU?,168,2 years ago
Which institute is better to pursue MBA in terms of placements: LPU or Jamia Milia Islamia?,225,2 years ago
Which are the top colleges to pursue B.Com in Punjab? I am expecting 92% in 12th. Would Bikram college be a good choice?,9,2 years ago
Is it right to choose SRM or LPU for automobile engineering?,17,2 years ago
"Which is better for an MBA, Lovely Professional University or Sikkim Manipal University?",18,2 years ago
To which university tier does Chandigarh University and LPU belong to? What is their rank in India?,10,2 years ago
What is the scope of physiotherapy course?,61,2 years ago
Which is the best college in Delhi to pursue Bachelors in journalism? Which is a better college among LPU and Amity University?,10,2 years ago
With 49.04 percentage Can anyone get admission in LPU in M.A. Psychology If her marks in B.A. In Psychology are 56 percent?,8,2 years ago
"Which is a good college for B.Tech in mechanical branch MIT, Pune or LPU?",149,2 years ago
Which is a better university for CSE: LPU or SASTRA?,75,2 years ago
Hi I am Pooja and soon I'll be the part of LPU. I have applied for BCA and want to know about the placement records for the same?,69,2 years ago
Which university is best for CSE LPU or VIT according to: 1 Placement 2 best teachers 3 good out put 4 infrastructure 5 good behaviour.,6,2 years ago
Is Lovely Professional University a good choice for pursuing B.Tech CSE?,210,2 years ago
What is eligibility to join MBA in LPU?,52,2 years ago
How's LPU for btech in CSE,111,2 years ago
Is LPU good for animation?,168,2 years ago
Which are the best colleges to pursue fashion designing?,7,2 years ago
What is the eligibility criteria for the entrance of M.Sc. In biotechnology?,23,2 years ago
Are LPUNEST and JEE both exams needed to get admission in LPU for B.Tech?,156,2 years ago
"Which college is better for CSE among Galgotias, Graphic Era and LPU?",187,2 years ago
"Which is a better college to pursue BA LLB, LPU or Lloyd Law College?",254,2 years ago
Which are the best colleges for B.Arch? I have scored 156 marks in JEE Mains paper 2.,193,2 years ago
Is it a right decision to pursue MBA from Lovely professional University – Punjab or not?,229,2 years ago
"Which is best for CSE: LPU or NIT, Tadepalligudem?",108,2 years ago
I have 50% in UG. Can I apply in LPU for MCA?,38,2 years ago
"How LPU is doing in Research and development? Honest answer, please.",9,2 years ago
How is LPU university for doing B.Tech (CSE)?,122,2 years ago
Is it compulsory to give CAT MAT and XAT tests for admission in MBA hospitality and tourism in LPU?,22,2 years ago
How is LPU for pursuing law? How is its placements? When will the entrance test take place? What is its admission process?,64,2 years ago
"Which institute is better for pursuing BBA: Amity-Jaipur, LPU or Prestige-Indore?",402,2 years ago
Is lovely professional university good to pursue B.Tech?,119,2 years ago
Does B.Tech from LPU have any scope or not?,160,2 years ago
Which is good in term of placement in engineering LPU or JEC Jaipur,164,2 years ago
I got 60% in 12th science. Can I get admission in aeronautical engineering?,290,2 years ago
How is LPU to pursue MBA? Which MBA specialization has more demand?,128,2 years ago
How is Lovely Professional University to pursue BE or B.Tech program?,53,2 years ago
Is LPU is good for Molecular Biology?,3,2 years ago
Which one is better? Thapar or LPU? In placements.,52,2 years ago
"What is the Research, Start-up & Innovation option in LPU for Bio-Sciences domain?",5,2 years ago
Is LPU a good uni to to get a mba degree from? Are it's placement records good?,33,2 years ago
"Why should I consider LPU for ECE? My Good JEE Mains score may get me into some NIT, is there any advantage that LPU has over NITs?",7,2 years ago
What about Zoology courses at LPU?,13,2 years ago
Is the Punjab defamed due to narcotics? Is there any cell in the college for such mal practices? I am from Delhi.,48,2 years ago
What is so special about interview preparatory classes at LPU? Doesn't every college do it?,64,2 years ago
What about Zoology course at LPU?,24,2 years ago
Is  LPU university best for mechanical engineering? I got 98.1% in 10+2 and I am very poor. I am from very small village.,182,2 years ago
Are there any special scholarship scheme introduced by LPU. I still have to undergo my exams.,32,2 years ago
I want to take admission in LPU for civil engineering? Is it worth to do the same?,28,2 years ago
Does B.Tech graduation from lovely professional university is accepted by Kerala psc.,62,2 years ago
Is Diploma in engineering course available in LPU? I am looking for a Diploma in computer engineering.,13,2 years ago
Is it compulsory to have mathematics as a subject in 12th to take admission in B.Com (Hons. )?,21,2 years ago
How is Lovely professional University for B.Sc physics for a bright Indian student interested in pursuing PhD and a career in physics?,62,2 years ago
What is the fee structure for MBA in LPU?,112,2 years ago
Is it worth pursuing B.Tech CSE from LPU?,22,2 years ago
"Is doing MBA at Lovely Professional University (LPU), Punjab valuable or not? What will be the package for MBA freshers in placement at LPU?",11,2 years ago
What is the minimum and maximum salary package offered to the student pursuing B.Tech in agriculture engineering in LPU?,141,2 years ago
How much percentage in 12th is required for admission in B.Tech?,804,2 years ago
Is LPU a good college for a B.Tech in biotechnology?,17,2 years ago
Which one should I prefer for animation courses: Bharati Vidyapeeth University or Lovely Professional University and why?,88,2 years ago
What are the measures taken at LPU Hostels during COVID 19 situation?,7,2 years ago
Can you tell me about civil engineering?,9,2 years ago
Percentage of 12th matters for admission of MCA is LPU?,18,2 years ago
Is it worth pursuing B.Tech CSE from LPU?,22,2 years ago
Am I eligible for BCA after taking commerce without maths in class 12th with CBSE Board.,19,2 years ago
"Is LPU there in Bangalore, Karnataka?",323,2 years ago
What is the eligibility criteria to pursue B. Des from LPU?,11,2 years ago
How can I take admission in LPU? Is admission based on JEE exam?,14,2 years ago
Can I join LPU dual degree BBA+MBA with commerce without maths & 90% in 12th? What is the placement record for this programme?,21,2 years ago
I am seeking admission in Ph.D. in Biology at Lovely Professional University. What is the procedure?,11,2 years ago
What is the scope of BBA+MBA?,18,2 years ago
Can anyone share the LPU's the latest patented research in Bio-sciences that can be commercialized?,13,2 years ago
Is there good placement in CSE branch at LPU?,17,2 years ago
How is the placement of an MBA at LPU? What is the average package offered to MBA students in LPU?,13,2 years ago
Which is better for product and industrial design between lovely professional university & M.S Ramaiah university-Bangalore?,379,2 years ago
Hows Faculty in The Biology department of LPU? How are the placement and opportunities?,2,2 years ago
Is LPU good for civil engineering? How are the placements of the same in LPU?,9,2 years ago
How good is Lovely Professional University for an MBA?,22,2 years ago
With 49.04 percentage Can anyone get admission in LPU in M.A. Psychology If her marks in B.A. In Psychology are 56 percent?,8,2 years ago
Is LPU provide distance education for M. Ed?,27,2 years ago
Which college is better for a B.Pharma NIMS or LPU?,13,2 years ago
I want to know the difference between UGC approved and AICTE approved For engineering course. As LPU is UGC approved not AICTE.,33,2 years ago
Is LPU offered Law courses?,24,2 years ago
Is it a good choice to pursue M.Sc. (Forensic Science) from LPU? Is there any entrance exam in this particular field?,20,2 years ago
I am interested in doing B.Tech in agricultural from LPU but have heard that B.Tech graduates don't earn more than 10000. Is it true?,112,2 years ago
Is LPU a good university to opt for B.Sc. Agriculture?,23,2 years ago
"What are the pros, cons & difference between doing B.Tech agricultural engineering from a private (like LPU) and a government college?",135,2 years ago
What is scope of doing Civil engineering from LPU?,7,2 years ago
Is game design in LPU good? What is the qualification for the course?,6,2 years ago
I need admission in Lpu (hotel management ) can you say admissions are open or close.,13,2 years ago
I have scored 92.7% in JEE Mains paper 2 but my HSC percentage is 70. Is it tough to get admission in LPU for B.Arch?,8,2 years ago
What is the fee structure for MBA in LPU?,127,2 years ago
"Iam completing my Diploma final year 5th sem in EEE, I cleared all my subjects with 90% can I get seat in lpu for B.Tech.",14,2 years ago
I got 97.87 percentile in JEE Main 2021 can I get admission into lpu.,64,2 years ago
"Can I get admission for MBA in LPU, Amity and Sharda? I got 71% in 10th, 53% in 12th, 49.85% in engineering and 670 marks in MAT.",149,2 years ago
Which college is better for B.A. LL.B. BHU or LPU or AMITY?,19,2 years ago
I need Migration/Transfer Certificate from LPU?,1100,2 years ago
"Sir, I want to know that do universities provides placement after B.Sc course?",215,3 years ago
What should be percentage in 11th and 12th class in commerce to join the B.Sc. Game design in LPU University.,10,2 years ago
What is the eligibility criteria for M.Sc. Physics in LPU?,23,2 years ago
"Which is a better college to pursue B.Tech in mechanical engineering through lateral entry, LPU, ACET or MIT ADT-Pune?",292,3 years ago
"Sir,  I have got 87% marks (in best four) in my boards exam . Can i get admission here",158,3 years ago
I have secured 30 marks in JEE Mains and 90 % in Telangana board. Can I get admission?,135,3 years ago
Can I get admission in Thapar University or LPU with 276768 rank in JEE Mains? I belong to general category.,135,2 years ago
How is MCA programme at LPU?,12,2 years ago
Only cipla visit the college for pharmacy for 160 students?,404,3 years ago
"Which university among Chitkara, Chandigarh University and LPU provide SAP course inside the university itself?",12,2 years ago
Is dual degree BCA+MCA a good course from LPU?,18,2 years ago
"I am 56 years old and cleared my B.Com in 1984 with 61.61% from D A V College, Jalandhar (GNDU Amritsar). Can I apply for LLB?",30,3 years ago
How to get admission for Masters in horticulture?,26,3 years ago
"My JEE Main (jan) percentile is 95.46? And I am appearing in JEE Main sept? Should go for srm, lpu, amrita like college? Or not?",9,3 years ago
LPU college Delhi in B. tek fees kitna hai.,28,3 years ago
Does LPU provide scholarship to M.Sc. Horticulture students? How do I prepare for the entrance exam of this course?,7,3 years ago
Can I get admission in LPU for M.Sc. Ag. Through LPU entrance exam even if I did B.Sc. Ag. From private college?,8,3 years ago
B.Tech Applications accepted @LPU through JEE 2021. Ranked 4th best university in India by Outlook. The highest package 42 Lacs. Apply now.,10,3 years ago
I got 188 marks in JEE Main paper2. Can I get a seat in LPU? What is the fee structure?,312,3 years ago
I got an aggregate of 79.8% in class 12th. Can I get admission in BA?,126,3 years ago
"Can you share some details about Ph.D. at LPU, course work and mentors?",30,3 years ago
What is the last date of taking admission in LPU?,92,3 years ago
Has anyone attempted Ph.D. entrance of LPU? Please help me understand its pattern of question and difficulty level.,72,3 years ago
What is the admission procedure of LPU for Ph.D maths?,96,3 years ago
What are the specialisations do you provide in M.A. Mass com in LPU university?,10,3 years ago
Is maths compulsory for B.Com and MBA in Lovely Professional University?,18,3 years ago
Can you share the details regarding faculty in LPU for B.Sc Economics?,141,3 years ago
What is the fees structure for MBA in lovely professional university?,10,3 years ago
"Which university best for MBA and M.A. Economics CU, chitkara university or LPU?",104,3 years ago
Can I do Diploma in computer Science and engineering after 10th this year in LPU.,18,3 years ago
Does LPU offer any Teaching fellowship for Ph.D. candidates?,37,3 years ago
How is the placement of M.Tech IT in LPU?,256,3 years ago
"Which is the best branch of engineering in terms of scope, placement and salary?",8,3 years ago
Will I get a UGC approved degree from those private universities whose compliance to UGC norms are still awaited till UGC's next visit?,2500,3 years ago
Is it a good decision to do M.Tech from LPU?,143,3 years ago
How many marks are required in JEE to get admission in LPU?,286,3 years ago
Which branch of engineering offers the best placement in LPU?,220,3 years ago
Which university is best for B.Tech in food technology: Jaipur National University or Lovely Professional University?,87,3 years ago
When to apply for admission in LPU? If I apply in May will I get a scholarship if I score good percentile in JEE?,58,3 years ago
Is it worth to pursue LL.B. And BBA or not from this university? How is the faculty and environment there?,38,3 years ago
What is the cutoff for CSE at LPU?,60,3 years ago
What are the scope after BBA and MBA?,142,3 years ago
Do you have medical courses?,9,3 years ago
What are the annual charges for Mess facility?,5,3 years ago
"Can a commerce student apply for B.Sc(Airlines, Tourism and Hospitality)?",396,3 years ago
"Which university is better for integrated courses amongst LPU, SRM and VIT?",235,3 years ago
Can you share some more information about LPU? Is it worth to pursue B.Tech honors? Is CSE branch good or not?,165,3 years ago
"Is LPU, Jalandhar good for B.Tech in aeronautical engineering?",56,3 years ago
"Which branch is good at LPU, CSE, ECE, mechanical or others?",16,3 years ago
I want to take admission in LPU for VFX and film making. What is the fees and scholarship criteria for this course?,132,3 years ago
What is the procedure of taking admission in MBA in LPU?,89,3 years ago
Which one should I prefer for B. Des: Lovely Professional University or Unitedworld Institute of Design and why?,55,3 years ago
Which institute is better for B. Des: LPU or JDIFT?,394,3 years ago
How is Diploma course at LPU.,42,3 years ago
Am I eligible for M.Sc in forensic Science or not? I am doing B.Sc (Hons. ) in electronics from University of Delhi.,44,3 years ago
