question,views,posted
What is the placement record of agriculture course in LPU?,524,a year ago
What is the process to apply for direct admission in Lovely Professional University (LPU) through the Secondary School Certificate?,19,a year ago
What are the timings for library?,248,a year ago
Is MBA at LPU is better then at Amity?,321,a year ago
"Which college is better for B.Sc Agriculture between LPU and Doon Business School, Dehradun?",563,a year ago
Can I get placement after completing BBA from LPU?,63,a year ago
Are there any placements for applied psychology students at LPU?,201,a year ago
What qualities make LPU different from other colleges?,450,a year ago
Is M.Sc. Horticulture comes under ICAR approval in LPU?,85,a year ago
"I want to know about studying BBA at LPU, which is better, LPU or Punjabi University Patiala for placements.",24,a year ago
"Sir, I want to study film and television production three year course. Which place is better for this course Mumbai or Punjab (LPU)?",81,a year ago
I heard from some where that LPU has swimming pools in campus. Is it true?,201,a year ago
How can I apply for B.Com in LPU?,278,a year ago
"Which is the best college to pursue B.Tech, LPU, SRM (Delhi), Amity University or DIT?",875,a year ago
"Which university is best for MBA among LPU, Galgotia University, GLAU, Thapar university and Sharda university?",47,a year ago
Which is a better college to pursue B.Tech among DIT and LPU?,358,a year ago
Can you tell me about B.Tech in civil engineering?,160,a year ago
"Which is the best, LPU or MMMUT?",63,a year ago
"I am interested to run my own medical store after my studies, my father has planned B.Pharma for me from LPU, Will it be helpful for me.",720,a year ago
How is placement in bsc agriculture and is placement in agriculture every year?,942,a year ago
Is LPU a good choice for doing M.A. in English?,207,a year ago
Is LPU good for hotel management in terms of placement?,888,a year ago
Is there anyone who wrote Kerala psc exam after taking graduation in B.Sc. Agriculture from lovely professional University.,56,a year ago
"Which is better among LPU and NIMS University, Jaipur for B.Tech in agricultural engineering?",56,a year ago
Which college is better for CSE LPU or Jaypee Noida? Does LPU have large number of students in single branch & due to this placement is bad?,137,a year ago
"Which college should I join for a BBA among below three in India Sharda University, Lovely Professional University or OP Jindal, Sonepat?",88,a year ago
"Can I know which is the best for CS among LPU, KIET, JSS, or AKG?",238,a year ago
What is the duration of the Ph.D. programme for M.Phil. Research scholars at LPU?,22,a year ago
How is Lovely Professional University?,283,a year ago
"Which is a better college for CSE among LPU and Jaypee, Noida?",1100,a year ago
Is LPU the best university for B.Tech?,69,a year ago
"which college would be better for btech cse program, lpu or poornima college?",162,a year ago
Which is a better option for MBA: UPES or LPU?,658,a year ago
Do LPU have separate room facilities in the hostel?,137,a year ago
How are the placements for a B.Tech mechanical student at LPU?,70,a year ago
"Which is better to study aerospace engineering, LPU or UPES?",81,a year ago
Why LPU scholarship reduces with each passing phase during the time of admission?,62,a year ago
Can I know which is better: Amity Noida vs LPU?,72,a year ago
I got 80% in 12th CBSE and given CLAT exam. Can I get admission now? What is the fee structure for 5 years including hostel charges?,174,a year ago
How is the BBA course at Lovely Professional University?,523,a year ago
How is the LPU's ECE programme? Does this programme make me eligible for NASA?,32,a year ago
"I am in Delhi and looking for PhD-Part time from Lovely Professional University, what all the flexible options I can get.",111,a year ago
Which one is better for MBA? LPU or PIBM Pune.,443,a year ago
How good is LPU for mechanical engineering?,54,a year ago
Is Galgotias University and lovely professional university is good for engineering and which university should I prefer to.,183,a year ago
What is the placement range for agriculture B.Tech in LPU?,136,a year ago
Is it possible to get direct admission in LPU for MBA without giving any CAT/MAT or other entrance exams? I scored 57% in B.Com.,979,a year ago
Is LPU a good option for B.Tech CSE?,211,a year ago
Which is better lpu or Chandigarh university for MBA ib?,544,a year ago
Is LPU going to plan 2021 session classes also online?,49,a year ago
Which is better for MBA- Lovely Professional University or Sikkim Manipal University?,152,a year ago
What are the different scholarships offered by LPU?,97,a year ago
What are the Career prospect after pursuing LL.B. From LPU? Also please specify Academic quality.,41,a year ago
What is the fee structure for students attending the Delhi campus of LPU?,56,a year ago
Which is better in terms of placements between mechanical engineering from Thapar or CSE from LPU?,166,a year ago
"Which college is best to pursue B.Tech CSE amongst MSRIT, BMS and LPU?",557,a year ago
What is the Lovely Professional University's policy on admission for SC/ST candidates? Do they need to take entrance exams?,28,a year ago
What is the minimum and maximum duration of a Ph.D. programme (full time/part time) at LPU?,21,a year ago
How is LPU for pharmacy? How is it in terms of placement?,641,a year ago
Which is the best college for CSE among Galgotias and LPU?,185,a year ago
Does LPU provide Scholarships to students? I have financial issue?,522,a year ago
I want to know if Lovely Professional University is good for fashion design.,64,a year ago
Is there100% placements in LPU for law? Is LPU worth joining for law?,180,a year ago
Can I go for a B.Arch in LPU?,163,a year ago
What are the career opportunities being provided by LPU?,83,a year ago
Which is best for mechanical Chandigarh university or kiit or lpu or vit.,158,a year ago
Which college should I choose for a B.Tech in CSE? Should I go for LPU or UPTU or IPU?,55,a year ago
What students' study in the first year in Ph.D. at LPU?,19,a year ago
"Which is the best college to pursue B.Tech in biotechnology, Amity University, Galgotias University or LPU?",365,a year ago
When is admission for an MBA 2023-25 going to begin in LPU?,19,a year ago
Which University is better for hotel management among Chitkara University and Lovely Professional University?,691,a year ago
Is LPU a good university good for B.Tech in CSE?,1100,a year ago
What is the scope of MBA in HR from LPU?,73,a year ago
"Which is a better institute to pursue MBA, LPU or IIM?",1600,a year ago
Is LPU (lovely professional University) a good college for B.Tech in mechanical engineering or should wait for UPTU results?,223,a year ago
How were the placements for an MBA at LPU?,82,a year ago
What is the condition of placement for a BCA at LPU?,48,a year ago
Is distance education allowed for working professionals? Am I eligible for distance education in LPU or any other university?,91,a year ago
Is BBA in International finance a good choice at LPU?,40,a year ago
What is the fees at LPU? Is there any scholarship available?,36,a year ago
Which is best for B.Tech in CS LPU or CU.,77,a year ago
Is it worth to study CSE from LPU?,102,a year ago
How beneficial is M.Sc. (Clinical Embryology) programme & what is the admission eligibility Criteria in LPU?,22,a year ago
Can we change from CSE to CSE hons after the 1st year in LPU?,32,a year ago
Can I know what are the career prospects after pursuing LLB From LPU?,32,a year ago
"Can I get admission, if I do not clear NEST exam?",319,a year ago
"What should I choose, CSE from LPU or CSE at JIET Jodhpur?",33,a year ago
Will I be eligible to pursue BBA from LPU if I have less than 40% in class 12th?,59,a year ago
How are Mechanical labs at LPU. What are the latest equipments in the labs.,298,a year ago
Is it a good choice to pursue BBA in IT from LPU? How is its placement assistance?,195,a year ago
How about Placements at LPU for the recent pass-out batch?,188,a year ago
"Can I know which is a better choice, a BE from Bhilai Institute of Technology, Durg or a B.Tech from Lovely Professional University, Punjab?",40,a year ago
How is LPU for pursuing CSE? Can I get on-campus placement in LPU?,368,a year ago
Where can I find previous year's question papers of LPU?,31,a year ago
Is LPU against government guidelines that are passed in favor of reopening of universities/institutes?,65,a year ago
Is internship provided in LPU for BBA (Hons. ). During the course period?,29,a year ago
Is LPU capable enough to give practical exposure while pursuing B.A. Journalism there?,61,a year ago
"Which is the best college to pursue B.Tech in CSE, LPU, SRM or CGC?",88,a year ago
For B.Tech in agricultural engineering LPU is a better option or PAU (Punjab agricultural university) in terms of placements?,94,a year ago
"I want to know which college should I take in terms of ROI, VIT Vellore CSE at 190000 per semester or LPU CSE is at 120000 per semester.",32,a year ago
I have 64 marks in JEE and 85% in class 12 by CBSE board. Can I take admission in any eeingeniering colleges for CSE.,44,a year ago
How's Ph.D. food technology at lovely professional University?,25,a year ago
Should I do an MBA in supply chain management from LPU?,303,a year ago
I want to know about Masters in fashion designing in lpu and all about placement after M.Sc. Fashion designing from lpu.,22,a year ago
Is Lovely Professional University (LPU) a good choice for hotel management?,636,a year ago
Is it a good choice to pursue B.Tech from LPU?,566,a year ago
What is the last date to apply for B.Sc in forensic science?,577,a year ago
How much minimum placement I can except after completing MBA from LPU?,567,a year ago
Are lateral entries supported in LPU?,219,a year ago
"Can I know which is better for a B.Tech in CSE, Jamia Millia or LPU?",35,a year ago
Can I prepare the questions of NIFT exam for the entrance of LPUNEST for fashion design? Is it beneficial?,229,a year ago
How is the atmosphere in LPU?,313,a year ago
Can I know if the Lovely Professional University is a good college for Civil Engineering?,25,a year ago
Does LPU offer any Part time Ph.D?,169,a year ago
Which college is better among DTU and LPU-Punjab for B.Tech lateral entry?,341,a year ago
I am a final year student of Diploma in mechanical & want to join LPU after it. Does LPU offers admission through lateral entry?,234,a year ago
How does LPU researchers cloud based web interface help to detect covid 19?,10,a year ago
Which college is better for placement R.V College of Engineering or LPU? I got 3592 in LPU-NEST 2018.,560,a year ago
What is the total expense including food and living for doing B.A. honors in English at LPU?,97,a year ago
Can I know are there jobs after completing a BBA at LPU?,38,a year ago
"Can I know from the start, how do we have to pay the fees in LPU?",34,a year ago
How does LPU manage their e waste in their campus?,77,a year ago
"I want to know if I should join LPU with 95%ile in Mains (I cannot join LNMIIT bcoz of fees), I have the option in MMMUT (IT) open too.",12,a year ago
Tell me about the B.Sc. Statistics programme of LPU.,9,a year ago
What is the placement record for CSE in LPU?,209,a year ago
What is the scope of B.Pharma in LPU?,415,a year ago
What is the cut-off for each branch in Lovely Professional University (LPU)?,12,a year ago
What if I score zero in mid term exams in LPU?,153,a year ago
Which is better for B.Tech computer Science Chitkara University or Chandigarh University?,63,a year ago
How are the studies & placements at LPU if CSE is pursued?,390,a year ago
Which university is better among SOA Bhubaneswar and LPU Punjab?,106,a year ago
Can I know how many hours of classes per day are conducted for an M.Tech in Computer Science and Engineering at LPU?,443,a year ago
Is it a good choice to pursue a B.Tech in biotechnology from LPU? How is its placement assistance?,11,a year ago
Am I eligible to get any scholarship offered by LPU?,262,a year ago
"Can I know, how are the placements and salary of an integrated MBA from Lovely Professional University?",16,a year ago
Can I take admission in LPU without NEET?,15,a year ago
Which one is best for computer science engineering: LPU or DIT?,607,a year ago
What are the job prospects for students who complete an MCA from LPU Jaipur? What is the average salary that MCA graduates get?,23,a year ago
"Can I know which one should I join, Symbiosis or LPU?",30,a year ago
How is the placement of BBA in LPU?,3500,a year ago
Can i migrate to LPU after my 1st year? I am in Srm university Haryana pursuing BBA+LLB?,183,a year ago
Which is the best university for CSE among Anna University - Chennai and LPU – Punjab?,660,a year ago
Can I know which is better: IIIT Sonepat or LPU?,35,a year ago
"Are there any colleges in Jalandhar, Punjab which provide graduation via correspondence?",201,a year ago
Can I know does a B.Tech in CSE with specialization in machine learning at Lovely Professional University also include the teaching of AI?,18,a year ago
How much salary can I get after b.sc agriculture from Lovely Professional University.,462,a year ago
What are the benefits we get by doing PG Diploma in counselling and guidance from LPU?,54,a year ago
Which is the best college for master degree in filmmaking (editing) aaft or lpu or Mumbai University.,141,a year ago
Which one is better HDD or SSD laptop for CSE in LPU? And is graphics is necessary for CSE?,130,a year ago
Can I know if Lovely Professional University is good for M.Des courses in product design?,27,a year ago
Is himalayan university bsc graduation certificate eligible for mba in lpu?,108,a year ago
"Can I know which college should I prefer for CSE, LPU or JSS Noida?",29,a year ago
"Which institute is better for B.Tech biotech in terms of placement: SRM, LPU or Manipal Institute of Technology?",684,a year ago
What is the last date to apply for B.Sc. In forensic Science?,41,a year ago
I have 60.1% in 12th. How are the placements at LPU?,46,a year ago
What is the affiliation of LPU with Anna University?,19,a year ago
I have heard that EEE of LPU is not good. Most of the teachers are inexperienced. Is that true?,39,a year ago
Is B.Sc (hons. ) in Chemistry good for a biology student in LPU?,15,a year ago
Which is better among SRM and LPU in all means?,873,a year ago
"Which university is better among LPU, Chitkara, VIT, SRM, Amritha, DU, Amity, Pilani, Thapar and GNDU?",22,a year ago
Should I change my programme from CSE to a BBA in LPU?,28,a year ago
I want to know about the latest cutoff information for B.Sc. (Hons.) in Agriculture at LPU.,23,a year ago
What is the LPU international school?,15,a year ago
"I want to know what should I choose, a seat in LPU CSE honors, or a CSE donation seat in SRM.",16,a year ago
"Can I know how is a BBA LLB at LPU ranked in terms of quality of teaching, campus placements in comparison to other private law colleges?",27,a year ago
"What is the average salary for engineers in LPU, Jaipur and Kotak? Which branch of engineering has the highest average salary?",12,a year ago
Is LPU good for B.Sc. Economics?,14,a year ago
Why does not LPU allow iron in the hostel?,46,a year ago
Is Lovely Professional University good for CSE branch?,364,a year ago
"Which should I choose, MAIT vs LPU?",175,a year ago
Which college is better among LPU and MMM?,28,a year ago
"Which is a better university among Amity, Lucknow and lPU?",960,a year ago
Is it a right decision to choose Guru Nanak Dev Engineering College for CSE or should I choose LPU or Chitkara over it?,642,a year ago
Why does LPU give such huge scholarships?,18,a year ago
"Which is the best college to pursue B.Tech, TIT-Bhopal, LPU-Jalandhar, BBD-Lucknow or SRMU-Lucknow?",514,a year ago
In SRM Lucknow university or LPU which is the best for B.Sc. It?,96,a year ago
What is the dress code of an MBA student at LPU?,167,a year ago
What is the comparison of Lovely University and kidney University in terms of fees and classmate comparison?,27,a year ago
"Which college is better between LPU and IET, Lucknow?",204,a year ago
"Which university is better among LPU, Amrita and SRM for the branches like ECE and EE (electronics engineering)?",396,a year ago
"Which is the best college to pursue B.Tech, IET-Lucknow, or LPU?",261,a year ago
Which is a better option among BBA and B.Com to pursue MBA in future in terms of placements?,25,a year ago
Which among them is better between DIT University and LPU University?,35,a year ago
How are the MBA placements and does LPU has abroad tie-up in which MBA students can get international exposure for a semester?,283,a year ago
Which college is better to pursue BBA: Lovely Professional University or Graphic Era University?,2000,a year ago
Which university is best for doing Masters in Design - Sharda or LPU?,27,a year ago
Is it good to pursue MBA after B.Tech with CSE? What is the career scope and placement scenario?,14,a year ago
I have passed 10th and want to do 2 year agriculture diploma+4 year b.sc agri hons from Lovely Professional University.Is it good idea.,133,a year ago
Can I know after how much time will I get my degree from LPU?,44,a year ago
Does LPU offer direct admission for B.Tech? How do I apply for the same in 2022?,11,a year ago
I am interested to pursue MBA? Should I pursue MBA from LPU or VIT?,37,a year ago
How are placements in LPU to pursue MBA? What is the dress code? Is HR better or marketing or any other?,287,a year ago
Is it true that an LPU M.Sc. Agriculture student got a scholarship of 1 crore to pursue PhD?,23,a year ago
Which college offers direct admission for B.A. LLB?,32,a year ago
"Can you suggest the best universities having low fee structure? Which one is better among LPU, IGNOU and Symbiosis?",230,a year ago
Can I know about Lovely Professional University?,151,a year ago
What are the career options after completing an M.Sc. In film and TV production from Lovely Professional University?,21,a year ago
In which college the aerospace engineering labs are best: Hindustan University or LPU?,233,a year ago
I read reviews on LPU for MBA for half an hour and literally found nothing negative about LPU. Is it really so good?,29,a year ago
"Which are the colleges in Chandigarh similar to JECRC, SKIT and LPU?",6,a year ago
To which university tier does Chandigarh University and LPU belong to? What is their rank in India?,6600,a year ago
How to apply online for Transcripts at Lovely Professional University for WES evaluation? Please provide the link for it.,128,a year ago
How is the placement at LPU after doing MBA? What is their eligibility criteria?,447,a year ago
"Is LPU best for aerospace engineering? If not, can you suggest some good university? I don't want to drop 1 year for JEE preparation.",266,a year ago
"Which private university has good placements amongst Chiitkara, LPU, and Chandigarh University in automobile engineering?",150,a year ago
"Which institute is better for B.Sc agriculture amongst Amity, JCERC, LPU and Jaipur National University?",501,a year ago
I'm confused about taking admission in Computer Science Engg. Which uni should I go for as per  NIRF Rankings? Chandigarh University or LPU,9,a year ago
"Can anyone tell me if LPU accepts transferred students in B.Sc. Agriculture 2nd year? And if yes, then the procedure?",17,a year ago
What is the rank of LPU in India among other universities?,364,a year ago
Is LPU good for B.Tech CSE? I couldn't qualify for JEE Mains.,478,a year ago
The highest Package offered to B.Tech CSE at LPU.,517,a year ago
I am confused about private colleges for CSE. Should I join LPU or amity or Chandigarh university.. or any college from my state(MP)?,100,a year ago
How can we apply for B.Com in LPU-NEST?,282,a year ago
Is it worth to pursue MBA from LPU? What is the placement record for MBA?,1200,a year ago
Is it a good choice to pursue B.Tech in IT from LPU?,294,a year ago
Which college is best among Lovely Professional University and Chandigarh University?,143,a year ago
What is the procedure to pursue hotel management from Lovely Professional University?,151,a year ago
How about MBA in tourism and hospitality? What are the chances of placement? What is the percentile needed?,531,a year ago
Which is better among KIET and LPU for B.Tech?,530,a year ago
Which is better CSE at Lovely or Chitkara or Chandigarh University or Chandigarh group of colleges?,93,a year ago
Which college is better for B.Tech in CSE: Sharda University or Lovely Professional University?,270,a year ago
"What is the highest package of M.Pharmacy in LPU, Punjab and how many companies visit?",83,a year ago
How to get admission in BA in journalism course in LPU?,261,a year ago
Is LPU better university for MBA mainly in terms of placement? Please help me out.,204,a year ago
Is my decision right of taking admission in LPU for B.Tech CSE? I got 80% in 12th CBSE board.,480,a year ago
"Which university stands higher on NIRF Ranking List in Engineering, CU or LPU?",78,a year ago
"I haven't studied English in my class 12th, Can I get admission in BBA at LPU?",425,a year ago
Can I get admission in lpu for bpt without lpunest,156,a year ago
How is the staff and faculty in LPU for B.Tech CSE?,296,a year ago
What NIRF Ranking is achieved by Chandigarh University and LPU? Which one is better for Engineering?,90,a year ago
Is it a good choice to pursue B.Tech in CSE from LPU? How is its placement assistance?,184,a year ago
Which University is best for b.tech in cse Chandigarh University or Lovely professional University,85,a year ago
Which university is better for B.Com LLB integrated: Lovely Professional University or Chandigarh University?,835,a year ago
How is LPU for BBA. I want to know about placements?,502,a year ago
How are the placements of B.Tech in Mechanical Engineering from LPU?,1300,a year ago
Can do llb after degree(mh.law) in your  university,119,a year ago
What is the minimum salary package may I get if I pursue BHM + MBA from LPU?,163,a year ago
"Which University is best for pursuing hotel management course, LPU or Chandigarh University?",887,a year ago
What NIRF Ranking is achieved by Chandigarh University and LPU? Which one is better for Management?,62,a year ago
What is the fee structure of B.Tech in LPU?,527,a year ago
Which is better LPU CSE or RVCE any branch?,109,a year ago
Is it good to pursue BCA from Lovely Professional University?,272,a year ago
How is the placement for an MBA in finance at LPU?,84,a year ago
Why LPU is so famous in Punjab?,237,a year ago
What placement packages can I get from LPU after completing MCA?,516,a year ago
Can I still get admission in LPU to pursue B.Tech?,162,a year ago
What opportunities will I have by completing aerospace engineering  in lpu,205,a year ago
Should I opt for B.Tech in CSE in LPU or appear for JEE Mains again next year?,304,a year ago
Is LPU offering Sports Scholarship?,382,a year ago
"Which college is better DTU or LPU, Punjab for B.Tech lateral entry?",744,a year ago
Is LPU a good university for CSE? Can I know about its hostel facility?,222,a year ago
How do I get direct admission in LPU College for the CSE branch?,322,a year ago
Is it worth to join LPU? How is it in terms of placement? Does this college has no ranking in NIRF?,331,a year ago
Does LPU offer any journalism or media related course?,118,a year ago
How to get education loan to take admission in your college as I cannot afford to pay the big amount? Please tell me about loan.,198,a year ago
Is LPU good for civil engineering? How are the placements of the same in LPU?,263,a year ago
How good are the placements of LPU for 2020?,109,a year ago
Which college is good for a B.Pharma LPU or SRM?,817,a year ago
"Which institute is better for pursuing BBA: LPU, CU, Chitkara University or Symbiosis?",1200,a year ago
How much percentage is required in 12th for admission in LPU?,126,a year ago
Which course can I pursue from LPU after completing B.Com (Hons) in accountancy?,149,a year ago
How is LPU in terms of academics?,116,a year ago
Which is best college for aerospace engineering except IIT and iist.,99,a year ago
"Which is the best college for CSE among LPU, MIT-Pune, BVP-Pune and DY Patil?",456,a year ago
Can you share faculty details for LPU? Are they well qualified and Experienced?,94,a year ago
Which is the best campus among VIT and LPU in all aspects? Please elaborate.,244,a year ago
"please help me... Which college is best LPU, PEC, CU for b.tech in ME n CSE.... N why...?",666,a year ago
What are the Career prospect after pursuing LL. M from LPU? Also please specify Academic quality.,41,a year ago
"I need some help with admissions in LPU University, Punjab.",72,a year ago
Do LPU have approval from PCI?,297,a year ago
Can I get good salary package after completing my B.Tech from LPU?,195,a year ago
"Which university is better among VIT, LPU and SRM?",168,a year ago
What are the scholarship options does lpu provide?,562,a year ago
Which is the best college for MBA among LPU and Galgotias?,362,a year ago
What is the qualification of the LPU faculty?,198,a year ago
"Which is the best college to pursue CSE: Galgotias College, LPU, Chandigarh University, G L Bajaj or Sharda University?",83,a year ago
Is Hyderabad GRIET better than LPU?,360,a year ago
"Which college is best to pursue B.Tech CSE amongst JKLU, JECRC and LPU?",91,a year ago
How is LPU in terms of academics?,98,a year ago
"All universities claim to have the best placements, infrastructure, faculty members and lab. What so special about LPU?",38,a year ago
What is the placement scenario for biotechnology course at LPU?,316,a year ago
Which college is good among IMED and LPU? Which one is better in terms of placement and internship?,191,a year ago
What are the placement opportunities for MBA from LPU?,339,a year ago
How is the residential facility of LPU?,425,a year ago
