question,views,posted
"Which university is good for pursuing B.Tech, LPU or Sharda University?",266,2 years ago
How is LPU for pursuing computer Science?,49,2 years ago
"Which is a better college to pursue B.Tech among LPU and Oriental Institute of Science and Technology, Bhopal?",118,2 years ago
How can I get a scholarship in Lovely Professional University?,215,2 years ago
Which University is better for pharmacy Lovely professional University or Chandigarh University.,9,2 years ago
Which college is better among IET and LPU?,49,2 years ago
Which institute is better among Amity Noida and LPU for B.Sc forensic science?,161,2 years ago
Which are the best private colleges in Delhi and NCR for pursuing product design course? How is LPU?,166,2 years ago
Which one would be better -general BBA from Delhi University /Mumbai University or BBA with specialisation from LPU/ UPES?,57,2 years ago
Is LPU a good choice?,97,2 years ago
"Need expert help among these colleges which one is better for MBA-HR,for study n ROI. IMED puneLPU panjabPIMR indoreMIMT greator noida",164,2 years ago
"Which is best amongst Anna University , SRM and LPU?",259,2 years ago
"Which college is better for B.Tech in ECE among LPU, SRM and Satyabhama?",249,2 years ago
Which is the best college for CS LPU or Galgotia University.,20,2 years ago
Which is a better university for pursuing engineering between DAV University or Lovely Professional University?,273,2 years ago
"Which is the best university to pursue MBA in finance, LPU or BML Munjal University?",297,2 years ago
To which university tier does Chandigarh University and LPU belong to? What is their rank in India?,548,2 years ago
Which college to choose for pursuing CSE among JIIT and LPU?,297,2 years ago
Is the lpu is good option for chemical engineering.,34,2 years ago
I would like to know about architecture at LPU. Is it good for architecture. How about architecture placements at LPU. Please help.,675,2 years ago
"Which is a better university to pursue CSE among SRM University, Chennai and LPU?",126,2 years ago
Is LPU good for MCA placement?,22,2 years ago
if i secure 65% in 10+2 and 71 percentile in jee mains ..caan i get addmisin in btech,81,2 years ago
"Which college is better for CSE amongst LPU, JIIT, Galgotias and UPES?",372,2 years ago
What about automobile engineering? Which companies come there for recruitment?,124,2 years ago
Which one is better for B.Tech among LPU and Christ University?,457,2 years ago
"Is BCA (Hons) + MCA (Hons) the best option to do from LPU, Jalandhar? Will it be easy for me to get a placement after it?",181,2 years ago
"Should I opt for Guru Nanak Dev Engineering College which is a semi-Govt. college, LPU or any other universities like CU for B.Tech CSE?",83,2 years ago
Is this university good for B.Tech? Is the atmosphere of the university good for studies?,53,2 years ago
What is the donation in LPU university for computer Science?,58,2 years ago
"Which option is best for B.Arch- DIT-Dehradun, Gateway College, HZU-Dehradun, NIU-Noida and LPU?",54,2 years ago
Should I drop this year or take admission in LPU for pursuing B.Tech in civil engineering?,19,2 years ago
"Which is the best college for B.Tech among LPU, Amity and Galgotias?",256,2 years ago
Is LPU the best college for B.Tech (CSE)? How is its placement?,123,2 years ago
Which is the best college for B.Tech in Chandigarh? Which one is better among LPU and PEC University?,63,2 years ago
How is LPU for pursuing B.Tech?,108,2 years ago
Can I take admission in MBA in banking and finance stream? I got 67% in 12th commerce stream.,252,2 years ago
"Which is the best college for MBA/PGDM in international business among IILM-Delhi, IIMS-Pune and LPU?",123,2 years ago
Is LPU really good for B.Arch?,108,2 years ago
I am confused about taking admission in LPU or SRM for CSE. As I SEE that SRM is very expensive then LPU and I also got scholarship in LPU.,16,2 years ago
Is it true that 80 percent of students (LPU) get a placement package of 4 LPA?,113,2 years ago
"Which university is better for B.Tech, LPU or GITAM?",897,2 years ago
When to apply for admission in B.Sc. in forensic science course at Lovely Professional University?,322,2 years ago
Is UPES is good for B.A.llb . Or a Amity University or a LPU or a munjal university,35,2 years ago
How is LPU for pursuing engineering?,91,2 years ago
Which college is better among LPU and GITAM University?,269,2 years ago
Which college should I take among LPU and Oriental Institute of Science and Technology?,35,2 years ago
Which is the best course after B.Com in Punjab?,54,2 years ago
"Which University is best for m.pharm among Galgotias university Chandigarh university Chandigarh group of colleges ,landran And ,LPU",9,2 years ago
Is Lovely Professional University good for CSE?,54,2 years ago
I have passed 3 year Diploma in architecture. Am I eligible for this degree? What is the course duration?,69,2 years ago
How much package can I get after completing BBA from LPU?,103,2 years ago
How is aerospace faculty at LPU?,28,2 years ago
Is VIT a better option as compared to LPU?,197,2 years ago
Is LPU better for M.Pharma?,92,2 years ago
What is the percentage required in class 12th for getting admission in LPU and KPB Hinduja college for BBA?,65,2 years ago
I am doing B.Sc forensic science from Lovely Professional University. Can I get a chance to do M.Sc forensic science?,164,2 years ago
Which college is good for B.Tech in CSE in all the aspects- Manav Rachna or Chandigarh University?,11,2 years ago
"Is Amity, Gwalior is better than LPU for mass communication?",150,2 years ago
Which college is better for B.Tech in CS among LPU and SRM – Chennai?,229,2 years ago
What is cut-off of last year for B.Arch in LPU through NATA?,210,2 years ago
How is LPU in terms of placements?,64,2 years ago
How are Himgiri Zee and LPU university for pursuing LLB?,139,2 years ago
What is the minimum percentile required in JEE mains to get admission in sir JJ college of architecture and please don't advertise LPU here,11,2 years ago
How is LPU in terms of placement for MBA? Does it provide internships?,56,2 years ago
"Which is the best college to pursue mass communication course, LPU or Amity University, Noida?",23,2 years ago
What are the Sports Facilities offered by LPU to the students?,10,2 years ago
What is the placement record for CSE? What is the average and highest package offered for CSE?,60,2 years ago
Is it good to choose LPU for MBA in case if specialization is finance? How are the placements?,147,2 years ago
Can you compare between LPU and Jaypee?,141,2 years ago
How do universities like Amity University and Lovely Professional University contribute to the society and the nation?,5,2 years ago
How to get education loan to take admission in your college as I cannot afford to pay the big amount? Please tell me about loan.,74,2 years ago
Do you recommend to pursue mechanical engineering from LPU?,133,2 years ago
"Which is the best university to pursue B.Sc. (Hons) in chemistry, LPU, Sharda University, Galgotias University or KR Mangalam?",21,2 years ago
Which college is better among LPU and Madan Mohan Malviya University of Technology?,50,2 years ago
"Which is the best university to pursue BBA Amity University, BML Munjal or LPU?",66,2 years ago
Which of these is better: B.Tech in CSE from Lovely Professional University or BE in CSE from Chandigarh University (CU)?,81,2 years ago
Which is the better option for MBA: CU or LPU?,53,2 years ago
"How is LPU, Jalandhar for B.Tech CSE?",93,2 years ago
What is so special about interview preparatory classes at LPU? Doesn't every college do it?,131,2 years ago
Is it a good choice to pursue B.Com from LPU?,96,2 years ago
Which college is better to join: LPU or DIT?,39,2 years ago
What do you think about M.Tech civil at Lovely Professional University????,91,2 years ago
"Which college is better for law among LPU, Punjab and UPES, Dehradun?",341,2 years ago
Can my son get admission through lateral entry in B.Tech civil engineering in LPU?,18,2 years ago
Which is the best college for fashion designing in India?,81,2 years ago
Is this beneficial to participate in Sports at University Level? What is LPU's role in this respect?,4,2 years ago
Which is better: LPU or KIIT?,1300,2 years ago
How is Lovely Professional University for pursuing B.Tech in mechanical engineering? What about the placements for the same?,97,2 years ago
What is your review of Lovely Professional University?,720,2 years ago
Can I get a good job in an MNC after completing CSE from LPU?,63,2 years ago
Bio-Science Researchers and Scientists of LPU won the battle of developing 100% natural fruit flavored chocolates - is this true?,14,2 years ago
Is internship provided in LPU for BBA (Hons.) during the course period?,372,2 years ago
Is Lovely Professional University good for B. Des (graphics design)?,73,2 years ago
Is it good to pursue B.Tech in CSE from LPU?,173,2 years ago
Can you tell me residential facilities and safety measures adopted by LPU during COVID-19 pandemic situation? I want to opt for residential.,210,2 years ago
How is LPU to pursue product design course?,179,2 years ago
Can I apply for BCA? What is the last date for BCA course?,215,2 years ago
I am confused in deciding LPU Jalandhar and SRM Chennai for B.Tech CSE honours which is good among both?,54,2 years ago
Is LPU a good college for B.Tech. Engineering streams? How well is it's overall rating among Private Universities in India for engineering?,16,2 years ago
Can I get admission in B.Tech (CSE) from LPU without writing an admission test? What is the procedure?,257,2 years ago
"What do I choose between Lovely Professional University, Koneru Lakshmaiah University & CBIT, Hyderabad?",242,2 years ago
How is this university in terms of placements?,92,2 years ago
Which is better to pursue hotel management: LPU or IHMs?,43,2 years ago
Is it a good option to pursue BBA from LPU to get a good salary?,88,2 years ago
How is the faculty in LPU? Are they well educated?,30,2 years ago
Is LPU the right option for CSE?,132,2 years ago
"Do companies like Google, Oracle and Microsoft visit LPU for recruitment?",736,2 years ago
How much minimum placement I can except after completing MBA from LPU?,73,2 years ago
Which one is best for computer Science engineering: LPU or DIT?,50,2 years ago
"Which college is best between  dronacharya college gurgaon ,Lpu,niit neemrana and chitkara for btech in cs branch?",165,2 years ago
I have registered myself in LPU but it is not showing BBA option? Is LPU not having BBA course?,26,2 years ago
Which is a better university to pursue BBA Amity University-Jaipur or LPU?,71,2 years ago
Which one is better among Thapar University and LPU for CSE?,53,2 years ago
How important is Center for professional enhancement at LPU?,29,2 years ago
Which university is the best among LPU and SRM to pursue B.Sc. In hotel management?,41,2 years ago
"Which is the best college to pursue B.Tech in CSE, LPU, SRM or CGC?",72,2 years ago
I am confused in deciding lpu Jalandhar and srm Chennai for B.Tech CSE honours which is good among both.,51,2 years ago
Which one is better- PGDM from Jaipuria Institute of Management or MBA from Lovely Professional University?,51,2 years ago
Is it good to pursue b tech from manipal university or should I go for lpu - Shiksha. Com.,61,2 years ago
How is the placement of CSE in this college?,151,2 years ago
"One important question. Please tell which college is better for pursue B.Tech from CSE L.P.U, Jalandhar or JECRC, Jaipur ? Thanks in advance",49,2 years ago
Is CU good for mechanical engineering than LPU?,88,2 years ago
How is this college for journalism?,387,2 years ago
How is BBA LL.B in LPU?,41,2 years ago
Which institute is better for pursuing B.Tech: LPU or VIT?,43,2 years ago
"Which is a better college for B.Tech in CSE from among LPU, Veltech, BITS, VITEE, IIMT and all other private colleges?",57,2 years ago
What should I take to hostel in Lpu?,26,2 years ago
Can I get B.Arch in Lovely Professional University with NATA score? What minimum marks required?,37,2 years ago
"Which is better for fashion design course: LPU or VIFT, Bangalore?",48,2 years ago
I have scored 92.7% in JEE Mains paper 2 but my HSC percentage is 70. Is it tough to get admission in LPU for B.Arch?,144,2 years ago
"What are the top engineering colleges in South India for CSE branch? Will LPU, Jalandhar be a right choice for CSE?",131,2 years ago
Which is a better university to pursue MBA in healthcare among LPU and Manipal University?,98,2 years ago
How is LPU in terms of placements? Can I get the salary package of 10 lakhs after completing my higher education from LPU?,105,2 years ago
"Sir, how are the job prospects for a law student who has passed out from LPU? What is the highest and average salary for BBA LL.B student?",16,2 years ago
What's the minimum package of BBA from lpu,92,2 years ago
Can you suggest the best fashion design colleges in India?,22,2 years ago
Which college is better for B.Tech- LPU or Sharda University?,67,2 years ago
Which college is better for B.Tech in CSE: Sharda University or Lovely Professional University?,62,2 years ago
"Which is better to pursue B.Tech among ITM University, Rawal Institution and Lovely Professional University?",39,2 years ago
"Hi, I am 12th class student and want to know about LPU for BBA. How are the placements and the environment?",63,2 years ago
I want to know the ranking of LPU in private universities and in overall universities in India.,21,2 years ago
Which is the best option for mechanical engineering among lpu and Chandigarh university?,51,2 years ago
Is LPU starting classes of B.Tech (CS) starts with basics like C C+? What should I do? Should I go for coaching?,74,2 years ago
Is LPU a good university in terms of placements?,73,2 years ago
Is LPU a good university? How is its placement record? Is it better than Dayanand Sagar?,130,2 years ago
"Which university is better to pursue B.Tech, Amity University or LPU?",208,2 years ago
Is LPU a good college for nutrition and dietetics?,172,2 years ago
Lpu scholarship on basis of 12th board. ?,82,2 years ago
"What if I am not able to qualify LPU MBA interview, will I get admission?",138,2 years ago
Which is better to pursue B.Tech in CSE between LPU and Galgotias in terms of placement and faculty?,172,2 years ago
Can I get CS branch in LPU?,79,2 years ago
I have an aggregate mark of 77.4% in 12th exam.  Can I get admission in LPU?,124,2 years ago
What placement opportunities are given to students after completing a law course from Lovely Professional University?,77,2 years ago
How is the experience of LPU in film and production course?,102,2 years ago
How can my daughter study B.Arch in Amity University and LPU? She has scored 64.8% in class 12th and expecting more than 80 marks in NATA.,123,2 years ago
Which college is better among DTU and LPU-Punjab for B.Tech lateral entry?,34,2 years ago
Can I get admission in Lovely Professional University? I got 58.4% in State board.,104,2 years ago
"How is LPU, Punjab for engineering?",123,2 years ago
Is it worth to pursue MBA financial markets from LPU?,200,2 years ago
Is LPU a good university to pursue B.Tech in ECE?,178,2 years ago
Can I get a government job after completing UG from LPU?,70,2 years ago
What is the specialty of Lovely Professional University?,60,2 years ago
Is it a right decision to apply for 3 years LLB course in LPU Punjab? Is there any other university available better than LPU?,106,2 years ago
Is English medium or board necessary to take admission in M.Ed in LPU?,36,2 years ago
Is BPT course offered here?,289,2 years ago
Is there is a need of doing Diploma to pursue  B.Tech from LPU?,87,2 years ago
How is LPU to pursue CSE? Should I join it?,126,2 years ago
"Since there is complete lockdown in the country, how can I complete the admission process at LPU?",5,2 years ago
LPU residential facilities during COVID-19? Am I safe if I take residential facilities at LPU.,105,2 years ago
Is LPU good for Animation courses after 12th class? What is the Eligibility there in LPU?,49,2 years ago
Which university is better for B.Sc. Chemistry (Honours)- Sharda or LPU?,70,2 years ago
"How is LPU and Manipal University, Karnataka for MBA?",133,2 years ago
How is LPU for pursuing BBA?,85,2 years ago
Which engineering branch is better from LPU: Civil or Mechanical engineering?,123,2 years ago
Which is the best fashion designing institute in Kolkata? Which is the best fashion designing institute in India?,11,2 years ago
Is LPU a good choice for B.Tech?,64,2 years ago
"Which is the best college for CSE among Manipal University, LPU and Sathyabama University?",253,2 years ago
I have passed my 12th with 70% under PCB stream. Is LPU good for BJMC course or should I go for some other college?,19,2 years ago
How is Doon University and Lovely Professional University for B.Sc. Agriculture?,22,2 years ago
Is it a good choice to pursue B.Tech from some other campus of LPU?,79,2 years ago
LPU or LN Mishra Institute of Economic Development Patna College which one is good for MBA?,29,2 years ago
Which university is better among LPU and KIIT for MCA (lateral entry)?,213,2 years ago
Is it worth to pursue B.Tech course from LPU?,51,2 years ago
Do top MNCs visit LPU?,117,2 years ago
Should I choose Lpu or COMEDK colleges (rank 2166) for B.Tech CSE only?,41,2 years ago
I got CSE honors programme in LPU besides my local college. I am willing to join here. Is it worth in terms of placements and education?,21,2 years ago
Is Lovely Professional University good for B.Tech and provide high-end placements?,48,2 years ago
Can I get admission in lpu if in CSE if my boards percentage is less than 60% is there any other option to get admission?,5,2 years ago
What is LPU national entrance and scholarship test?,27,2 years ago
What do we learn in hotel management degree? Do we learn cooking or something else too?,14,2 years ago
Is it good to pursue B.Design from LPU?,211,2 years ago
How to get admission in Lovely Professional University for BCA programme?,98,2 years ago
Which one is best for computer Science engineering: LPU or DIT?,14,2 years ago
Should I opt for B.Tech in CSE in LPU or appear for JEE Mains again next year.,32,2 years ago
"Which one is better for mass communication, LPU or Manipal University?",13,2 years ago
Is Chandigarh university is good for B.Com llb?,20,2 years ago
"Sir, I have 58% marks in 10+2, will I not be eligible for NATA and JEE exam? I want admission in B.Arch.",257,2 years ago
Is LPU best for aerospace engineering and placement?,25,2 years ago
What about the placements?,51,2 years ago
"Which is the best college to pursue B.Tech in mechanical engineering through lateral entry among LPU, ACET and MIT ADT-Pune?",133,2 years ago
Can I know about the placement opportunities for BBA students? What is the fees structure of this course?,42,2 years ago
"Which is the best university to pursue MBA, Amity University, Noida or LPU?",24,2 years ago
How is this college for MBA? How is its placements for the same? Does this college provide 100% placements?,318,2 years ago
Is this university best for this course or not? I am 12th passout and got 80%.,251,2 years ago
"Which is a better college to pursue CSE among VIT, LPU, RVCE, SRM and KIIT?",66,2 years ago
How is fashion design programme in LPU? Does it have infrastructure for running this programme?,70,2 years ago
"Is there any private examination at VNIT, Bits, LPU and NIT?",42,2 years ago
"Which college is better for BBA amongst NCU, LPU and Sharda?",82,2 years ago
JEE Main rank 130000 obc rank 40002 can I get admission in lpu.,62,2 years ago
Is LPU offered Law courses?,71,2 years ago
Which is better between LPU and Graphic Era Dehradun for CSE?,957,2 years ago
"Which college will be better for MBA: IILM, Noida or LPU or Chandigarh University or UPES, Dehradun?",39,2 years ago
I want to study B.Tech CSE. Which college is better for Good placement to me LPU or SASTRA?,42,2 years ago
"Should I take admission in LPU in IT stream? , is placement is good for IT branch?",10,2 years ago
What is eligibility to join MBA in LPU?,100,2 years ago
Is it worth to pursue CSE from LPU?,203,2 years ago
"I want to go for an MBA, but Im confused regarding the reputation of LPU. Is it good? Will it be beneficial to do an MBA from LPU, or is it.",74,2 years ago
"Which one should I prefer for an LL.B: Lovely Professional University or Amity University, Kolkata and why?",79,2 years ago
"I heard LPU is assuring 100% placement, is it true?",25,2 years ago
Is LPU a better option for lateral entry admission in B.Tech (mechanical) among private universities?,62,2 years ago
Will I get a placement after completing MBA from LPU?,45,2 years ago
How is LPU for pursuing MBA? What is the fee structure of MBA in LPU? How is its placement assistance?,116,2 years ago
"Which is better among LPU, Chandigarh University and Chitkara University for B.Tech in CSE?",73,2 years ago
"Should I join LPU or drop this year, I scored 162 marks in JEE Mains?",1200,2 years ago
Can a good student get the package of Rs.10 LPA in CSE?,259,2 years ago
I have scored 92.7% in JEE Mains paper 2 but my HSC percentage is 70. Is it tough to get admission in LPU for B.Arch?,35,2 years ago
What is the course fee and average placement package of MBA at LPU? Is it a good university for this course?,108,2 years ago
"Which is a better college for B.Tech among Manipal, Jaipur and LPU?",119,2 years ago
Which one is better among Galgotias University and Lovely Professional University?,56,2 years ago
I am little concerned about how universities (LPU) and institutions will address social distancing when students join university/ institute?,33,2 years ago
I am currently studying aeronautical engineering diploma after that how many years i have to spent in collage for aerospace engineering ?,103,2 years ago
Is it a good choice to pursue CSE from LPU?,100,2 years ago
I want to join lovely professional university (CSE) how is lovely professional university.,36,2 years ago
How is Doon Business School for MBA? Is It better than LPU?,514,2 years ago
"Which college is better for B.Tech in CSE: Lovely Professional University or SRM University, Chennai?",57,2 years ago
"Which university is better for integrated courses amongst LPU, SRM and VIT?",67,2 years ago
Is LPU University good for gaming and VFX course?,41,2 years ago
How LPU is pioneer in providing sports facilities to students? Is this true student of LPU are participating in Tokyo Olympics 2020?,12,2 years ago
Can I do MBA in LPU with my open degree certificate? Please reply because I want to do MBA this year in LPU.,134,2 years ago
"Which private engineering college is good other than VIT, SRM and LPU?",30,2 years ago
Will this college get ICAR approval or not?,49,2 years ago
"Which is the best college for BBA among LPU and Amity, Jaipur?",186,2 years ago
Placements for B.Tech computer Science and engineering in lpu.,7,2 years ago
Is LPU good for pursuing CSE? Should I prepare for the JEE Mains? I have got 162 marks in the entrance.,161,2 years ago
Which campus of Amity university is the best for BBA-MBA integrated courser? Should I try for LPU?,66,2 years ago
Which university is good for doing BCA pu or lpu.,22,2 years ago
Is LPU good for HM?,217,2 years ago
Should I pursue hotel management course to become a chef?,8,2 years ago
How are the placements rates at LPU?,16,2 years ago
Can someone tell me if there are good packages offered to LPU students? Please be specific as this is question of future of my brother.,56,2 years ago
Can I learn French at LPU.,206,2 years ago
Can I get admission in B.Sc(Hons.) zoology now? I have passed my +2 CBSE with 91% marks.,204,2 years ago
What is proctored online exam paper introduced at LPU.,42,2 years ago
Are there any government jobs for students who are studying forensic science or get jobs in other countries?,114,2 years ago
Is a BBA+MBA at LPU University a good option?,50,2 years ago
"I want to do MBA, but I did not give any CAT or MAT exam. Can I get admission in LPU?",72,2 years ago
How can I get admission in LPU to pursue B.Tech in CSE?,187,2 years ago
I have inclination towards design programs. What is the placement opportunities at LPU for the same?,85,2 years ago
How are the placements in Lovely Professional University?,49,2 years ago
Are things too expensive in the LPU University mall?,66,2 years ago
I want to study B.Sc biotechnology in LPU. After completion of the course can I get a job? If I will get job how much salary will I get?,124,2 years ago
Can I get admission in LPU for fashion design? I have 63% in 12th.,52,2 years ago
Is LPU good for MBA or I can look for better options than LPU?,110,2 years ago
Can I expect a handsome package after doing BJMC course from LPU?,33,2 years ago
How is Zoology course at LPU?,17,2 years ago
Can I get admission in a reputed college to pursue BBA after completing 3 years Diploma in business from LPU?,115,2 years ago
Is Lovely Professional University good for B.Tech?,139,2 years ago
Can I get details about LPU?,91,2 years ago
What is the highest package offered by LPU for CSE?,5,2 years ago
What is the global scope with high packages for students studying in B.A. Journalism & Mass Communication at LPU?,69,2 years ago
How is LPU for B.Tech placements?,22,2 years ago
What is the process of admission for MBA in LPU? Is there any entrance exam for the same?,122,2 years ago
How is LPU for pursuing B.Tech mechanical?,84,2 years ago
Can you tell me about civil engineering?,32,2 years ago
Can I get admission in Lovely Professional University for B. Des if I am qualified in UCEED exams in merit?,208,2 years ago
I have 73% in 12th and 143 marks in JEE Main 2 and I have also position in sports in national level. Can I take admission in B.Arch at LPU?,161,2 years ago
Is it a good choice to pursue B.Tech from some other campus of LPU?,24,2 years ago
