question,views,posted
Does LPU offer any scholarship to orphan students?,134,a year ago
How are the placements in LPU for Civil Engineering dept. ?,477,a year ago
"IS LPU, CU or VIT good for mechanical engineering?",149,a year ago
What is the placement scenario of B.Tech. CSE in LPU?,495,a year ago
How good is LPU indoor stadium?,78,a year ago
Is civil engineering good at LPU?,120,a year ago
Is Lovely Professional University (LPU) a good choice for B.Sc. Hons agriculture?,110,a year ago
Is it good to take mechanical engineering in lpu?,480,a year ago
Does LPU offer any Film and TV production related courses?,126,a year ago
For aerospace engineering which is best LPU or Hindustan University? Anyone explain with reason? Please.,215,a year ago
Which university is better in terms of placement LPU or Chandigarh University?,239,a year ago
Is B.A. Passed student can apply for MBA marketing from LPU?,64,a year ago
How can I take admission in LPU for a B.Pharma?,275,a year ago
Why LPU is the best University?,375,a year ago
How is Lovely Professional University for an external or part-time PhD?,133,a year ago
Can we get a scholarship in the LPU on the basis of our percentage in the board exam?,364,a year ago
"Which University is having best infrastructure amongst Amity University, LPU, Banasthali University or CT University?",413,a year ago
"Which institute is good for B.Tech CSE. BITS, VIT or LPU?",105,a year ago
What is the fee structure of MBA in LPU?,73,a year ago
Is LPU Jalandhar good for mechanical engineering?,99,a year ago
What makes LPU as the best University?,112,a year ago
Shall I take admission for B.Tech mechanical engineering in BML Munjal University or in LPU for CSE?,194,a year ago
What is the minimum package that an MBA student can get at the LPU?,99,a year ago
"I am more inclined towards pursuing Hotel management courses after 12th, Please share the details of the programmes offered in LPU?",161,a year ago
How are the faculty members in LPU?,453,a year ago
Which college is good among TIT-Bhopal and LPU-Jalandhar?,278,a year ago
How is the mess food facility in LPU?,151,a year ago
Why Lovely Professional University is considered as best private University?,288,a year ago
"Which is best for CSE: NIIT, Rajasthan or LPU, Jalandhar?",229,a year ago
Is the entrance exam compulsory for a BBA in LPU?,200,a year ago
Is LPU best for CSE?,223,a year ago
Is it worth to pursue Ph.D. from LPU?,76,a year ago
How can I apply for Admissions in LPU?,54,a year ago
What are the great things about atmosphere of LPU campus?,376,a year ago
"For an MBA, which is better: UIAMS or LPU?",369,a year ago
Is LPU a best university to pursue hotel management?,353,a year ago
LPU is better or CU is better as university?,214,a year ago
What about ECE in LPU? What about the placements for lateral entries?,74,a year ago
Which is better: Amity Noida vs LPU on the basis of global ranking?,389,a year ago
Can a non-maths commerce student get admission in LPU for BBA?,840,a year ago
How is Integrated Law Programs - BBA - LL.B (Hons. ) in LPU in terms of Academics & Placement?,51,a year ago
Does LPU provide any placement to B.A LL.B graduates?,296,a year ago
Is LPU good for B.Sc forensic science?,297,a year ago
"One important question. Please tell which college is better for pursue B.Tech from CSE L.P.U, Jalandhar or JECRC, Jaipur ? Thanks in advance",71,a year ago
"Which are the best colleges among LPU, BITS, VIT, NITs, or IITs?",26,a year ago
What about the placements in LPU after MBA? What about the salary package?,39,a year ago
Is Ph.D. available in LPU?,286,a year ago
How is CU's placement for Civil engineering? Better than LPU?,184,a year ago
The highest Package offered to B.Tech CSE at LPU.,93,a year ago
How is B.Arch at LPU?,107,a year ago
Is Lovely Professional University good for a B.Tech?,113,a year ago
Which college is good for pursuing B.Tech CSE Galgotias University or LPU?,410,a year ago
Which companies visit LPU campus for placements of MBA?,67,a year ago
What is the rank of LPU in India among other universities?,97,a year ago
"LPU is offering MBA in different specialisation, which one should I opt?",47,a year ago
"Which university should I choose for automobile engineering, UPES or LPU?",105,a year ago
What are companies that visit at LPU for Civil Engineering?,332,a year ago
What are international tie ups is LPU having with Canada?,127,a year ago
"Can I know which university is good for CSE, LPU or UPES Dehradun?",45,a year ago
What are the placements in law programmes?,53,a year ago
Are faculty members of LPU really good?,201,a year ago
What are the international tie-ups is LPU having with Australia?,106,a year ago
Is LPU better than INIFD for fashion design or not?,200,a year ago
"Which is a better college to pursue CSE, MIT-Pune or LPU?",354,a year ago
Which is a better university Amity or LPU?,195,a year ago
Why one should opt for LPU over Amity University?,403,a year ago
"Which is a better college to pursue CSE, KIIT or LPU?",142,a year ago
"I need some help with admissions in LPU University, Punjab.",58,a year ago
Which college is better to pursue B.Arch among LPU and Amity University?,317,a year ago
What's the average salary of lpu  in bhm,286,a year ago
Which college should I join among LPU and CV Raman College of Engineering?,339,a year ago
Lpu or Amity university which one is the right choice for civil?,458,a year ago
Which one is good among LPU and Sharda University?,153,a year ago
Which is the best private college for product design course in Delhi NCR?,214,a year ago
Do I choose Thapar Institute over amity university or lpu? As I got to know from my friend that thapar institute is one of the best private!,33,a year ago
"Which is a better college to pursue BBA, Prestige-Indore or LPU? Can I pursue MBA abroad after completing BBA from the same?",193,a year ago
"LPU or AMITY, which one is better to pursue BCA-MCA dual degree programme?",512,a year ago
"For MBA I have two options LPU and Amity, which one should I opt?",272,a year ago
How are the Residential facilities available at LPU?,408,a year ago
Is LPU good for an LL.B. In terms of placements?,20,a year ago
Is LPU good for B.Sc. (Hons) Agriculture?,85,a year ago
Which one is the better option - SRM or LPU for CSE course and for placement opportunities?,32,a year ago
Can I get a direct admission in LPU with second division marks in 12th class?,23,a year ago
How are faculty at LPU?,398,a year ago
Is there any other campus of LPU available?,66,a year ago
Is it worth to join LPU? How is it in terms of placement? Does this college has no ranking in NIRF?,258,a year ago
"Want to stay in Punjab, looking for B.Tech CSE. Chitkara or LPU? Which university is good?",246,a year ago
Can a student get a scholarship in LPU if he scores more than 8 CGPA in an academic year?,264,a year ago
"Which university is better in terms of placement in UID-Industrial design, LPU, amity, chitkara or Chandigarh University?",633,a year ago
Which are the various categories on which LPU offer scholarship?,395,a year ago
"Which University has the better faculty for computer applications LPU, SRM or VIT?",55,a year ago
"Why should I consider LPU for ECE? My Good JEE Mains score may get me into some NIT, is there any advantage that LPU has over NITs?",64,a year ago
Is LPU a good college for a B.Tech CSE?,114,a year ago
Which is a better university among Amity or LPU?,152,a year ago
For integrated B.Sc+B.Ed which university is preferred LPU or Chandigarh University?,1100,a year ago
"Can I know how is LPU, and its placements?",31,a year ago
Are there drug addicts in Lovely Professional University's hostel?,247,a year ago
"Which is a better university to pursue BCA, Chandigarh University or LPU?",436,a year ago
Can I know how is B.Tech CSE at LPU unbiased review?,33,a year ago
Which is better among Bharath University and LPU?,766,a year ago
Can anyone list the number of accreditation LPU owns?,209,a year ago
"Which university should I choose for Automobile Engineering UPES, LPU, DIT, VIT or Amity?",52,a year ago
What is credit transfer option at LPU for study abroad programs?,891,a year ago
In LPU examination fees are including with admission fee or not?,21,a year ago
"Which college is best for B.Tech CSE. Lovely professional university, Punjab or JSS Noida.",75,a year ago
Does LPU provide good placements for mechanical engineering?,35,a year ago
"Which one is better, UPES or LPU for law?",100,a year ago
"Which is the best college among LPU, Punjab and KLU, AP as both of them are having approximately same rating?",385,a year ago
What are your reviews about LPU?,130,a year ago
How about Labs and opportunities at LPU for B.Tech CSE?,31,2 years ago
Is Lovely Professional University good for B.Tech in terms of placement and salary?,50,a year ago
What is the last date to apply for MBA in Lovely Professional University?,40,a year ago
"Which college is better, LPU or NDIM?",37,a year ago
"Which is better among LPU and Manipal, Jaipur (I am getting a scholarship in LPU)?",34,a year ago
Which is better in terms of placement & education LPU or CU or SHARDA UNIVERSITY or GL BAJAJ or GALGOTIAS?,271,a year ago
What is the fee structure of B.Com (Hons) in LPU?,415,a year ago
Is LPU good for civil engineering in terms of placements?,201,a year ago
Is LPU a better option than any UPTU college with respect to placements and preparing students for it?,135,a year ago
How were the placements for M.Sc food technology in LPU in 2021? What  was the highest package and how many students got placed?,103,a year ago
What is the difference between Apartment and hostel in LPU? Is Apartment better than hostel rooms in LPU?,1700,a year ago
Which university has high ranking between LPU and Amity University as per global ranking?,39,a year ago
Which college is better for B.Tech in CSE among LPU and Poornima University?,111,a year ago
"Which is better, MIT Pune or LPU?",17,a year ago
"Which university is better in terms of placement in UITHM Hotel management, LPU, amity, chitkara or Chandigarh University?",482,a year ago
Is it 100% sure that i will get admission in LPU  for BBA if i applied for it in online ?,87,a year ago
"Which university among Chandigarh University, LPU and Chitkara should I prefer for a Bachelors in agriculture?",136,a year ago
Is LPU good for a BCA?,257,a year ago
Should I pursue MBA from LPU or Chandigarh University?,73,a year ago
How is B.Tech Biotechnology at LPU?,474,a year ago
How is Lovely Professional University for BCA? Can I get admission easily in BCA? I have 52% in 12th.,31,a year ago
Which of these is better: B.Tech in CSE from Lovely Professional University or BE in CSE from Chandigarh University (CU)?,73,a year ago
Is it worth studying at Lovely Professional University in 2020?,76,a year ago
Can I get admission in LPU for B.A. LL.B. 2nd year?,68,a year ago
What are the achievements does LPU have in recent time?,382,a year ago
"Which university is better in all terms SRM, Amity, LPU or CU?",77,a year ago
How is LPU for pursuing MBA? Can I know about better the better colleges than LPU for pursuing MBA?,157,a year ago
"Which is better for education and placements, KLU or LPU?",82,a year ago
"Which university is better to study Electronics and Electrical engineering, LPU or Chitkara University?",334,a year ago
What about the placements?,254,a year ago
How good is LPU for a B.Tech in EE and EEE?,83,a year ago
I have scored 80.14% in JEE paper 2. Can I get a seat in LPU?,321,a year ago
Will I get admission in LPU with a score in the 80th percentile in the MAT?,93,a year ago
How much would a B.Tech in CSE at LPU cost without a hostel?,33,a year ago
"I want to know if I can get admission to LPU, I have completed my 12th in 2017. I have dropped two years.",34,a year ago
Should I do a B.Tech in CSE from LPU or Graphic Era University?,364,a year ago
"Is there any choice between LPU, Delhi and LPU, Jalandhar?",229,a year ago
What is the salary after doing an MBA from LPU?,251,a year ago
How is LPU for BBA. I want to know about placements?,338,a year ago
"I am a 12th student from PCM, which college/university is the best: Chandigarh Group of Colleges or Lovely Professional University?",81,a year ago
Can I get direct admission for an MBA in LPU or Chandigarh University without an entrance exam?,50,a year ago
Is LPU really good?,97,a year ago
Is LPU University good for gaming and VFX course?,204,a year ago
I am getting ECE in GNDU Amritsar and CSE in LPU. What should I choose?,27,a year ago
Which University hostels is safe for girls between CU and LPU.,533,a year ago
Is LPU and CU University valid in Nepal?,333,a year ago
"Does LPU, Chitkara, CU provide dual specialisation in MBA?",399,a year ago
Which one is better: Shiv Nadar or LPU for ECE?,82,a year ago
"Which college is best in terms of placements: Vel Tech, LPU, or Shiv Nadar?",90,a year ago
"I want to do B.Tech n CSE. Which university should I go for, Chandigarh University, LPU or Amity?",284,a year ago
How is the faculty of LPU?,383,a year ago
Are there Africans at LPU?,66,a year ago
"Is chaitkara University Chandigarh good for b tech in CSE rather then jmit radaur, ncu Gurgaon, Dronacharya gurgoan or lpu which tell me.",49,a year ago
How can I join any student organisation in LPU?,178,a year ago
What is the required minimum percentage in Bachelor's degree to get admission for MCA in LPU?,134,a year ago
"After B.A. Degree, can I take admission in MBA?",142,a year ago
Is it true that the placements provided by LPU are of low packages?,72,a year ago
Which one is better for MBA- Lovely Professional University or IIM Ahmedabad?,41,a year ago
"Which university is better, Amity University, Kolkata or LPU?",23,a year ago
Which one is better for fashion designing among Lpu and Chandigarh university??,239,a year ago
"Which college is better, Shiv Nadar University or LPU?",75,a year ago
"Which one is the best for B.Tech among LPU, Chitkara University, GNDEC and Chandigarh University?",224,a year ago
MBA business analytics from Chandigarh University or MBA business analytics from LPU. Which one would be a better choice?,96,a year ago
"Which is a better college to pursue B.Tech in petroleum engineering, MIT-Pune or LPU?",263,a year ago
Why LPU is called minicity?,309,a year ago
"Which is the best university to pursue BBA, Amity University, BML Munjal or LPU?",712,a year ago
Is it worth taking admission in Aliah University or LPU?,79,a year ago
What are different types of scholarships at LPU?,101,a year ago
"Which is the best university for B.Tech in CSE among LPU, Jalandhar and ITER, Bhubaneswar?",81,a year ago
Which is best for CS LPU or UPES?,23,a year ago
Which one is better among Shiv Nadar and LPU?,394,a year ago
"Which university is better in terms of placement in UITHM Culinary Science, LPU, amity, chitkara or Chandigarh University?",51,a year ago
"Which university is better to pursue B.Sc. In agriculture, Amity University or Lovely Professional University?",96,a year ago
What are different types of specialisations in MBA at LPU.,159,a year ago
Which one is better: Chandigarh University vs Lovely Professional University?,56,a year ago
"Which university is better in terms of placement in UID-Industrial design, LPU, amity, chitkara or Chandigarh University?",106,a year ago
"Which is better for a B.Tech in CSE, Sharda University, Amity, LPU or Chandigarh University?",295,a year ago
"Which is better for mechanical engineering: LPU Jalandhar or Dr. B R Ambedkar Institute of Technology, Bangalore?",100,a year ago
Which one is better for BBA among LPU and Amity University in terms of placements?,599,a year ago
What are the extra benefits for studnets having positions in board exams?,67,a year ago
"Which college is good among PEC University, LPU, CU and CGC? What is the rank of these colleges?",130,a year ago
Is LPU good for B.Sc. Economics?,105,a year ago
"Which is better for MBA Amity, LPU, CU or Bennett university?",76,a year ago
Can I get admission in Lovely Professional University? I got 58.4% in State board.,231,a year ago
Which is a better college among LPU and Chandigarh University?,263,a year ago
I'm eligible for one of the scholarships under students science exhibition category. Do I still need to apply for entrance?,134,a year ago
"Which university is better for B.Tech in CSE amongst Apeejay Stya University, Chandigarh University and Manav Rachna University?",109,a year ago
Which is best for CSE: MIT or LPU?,356,a year ago
How is B.Arch at LPU?,64,a year ago
I have registered myself in LPU but it is not showing BBA option? Is LPU not having BBA course?,34,a year ago
"Which is better for MBA Amity, LPU, CU or Bennett university?",106,a year ago
Does LPU offer any B.Com Hons?,56,a year ago
What would be the fee structure of B.Tech in LPU for 4 years including hostel charges?,79,a year ago
"Can I know how is LPU for a B.Tech in CSE in terms of faculty, atmosphere and placements?",50,a year ago
"Which is better among LPU, Chandigarh University and Chitkara University for B.Tech in CSE?",70,a year ago
"Which institute is better for pursuing BBA LPU, CU, Chitkara University or Symbiosis?",196,a year ago
"Which university is better in terms of placement in AIT CSE, LPU, amity, chitkara or Chandigarh University?",180,a year ago
"Is NIT-Patna better than the private colleges like PICT, VJTI, MIT, SRM, VIT and LPU?",864,a year ago
Is B.Tech CSE of LPU Is better than CU?,291,a year ago
Which is better LPU for B.Tech CSE or MSRIT for EEE? My profile: 12th PCM-84% and JEE Mains-62 marks.,248,a year ago
Can I know if Lovely Professional University is a good college for civil engineering?,19,a year ago
"Which is the best university for agriculture among lpu, amity, CU & sharda University.",54,a year ago
Which one is better in terms of management placements LPU or Chandigarh University if I want to do MBA in international business?,1300,a year ago
Which is a better option for ECE- LPU or CU?,819,a year ago
which college should i choose among LPU and Chitkara in branch CSE?,169,a year ago
Which is the best college for BBA among Amity-Jaipur and LPU?,27,a year ago
Is LPU and CU University valid in Nepal?,348,a year ago
Can I admission in LPU? I have not cleared LPU-NEST exam for B.Sc agriculture.,435,a year ago
Which one is better among LPU and KIIT?,1900,a year ago
Do I need to qualify LPUNEST exam to get admission in LPU for BA in journalism and mass communication?,141,a year ago
Is LPU a good choice for civil engineering?,29,a year ago
Which is better among LPU and Jain University?,1600,a year ago
How is the B.Com (Hons) at LPU? How can I get admission?,25,a year ago
"Which is best for CSE: LPU or NIT, Tadepalligudem?",349,a year ago
Is it worth to take admission in LPU for CSE?,636,a year ago
"Which is better for placements in M.A. English: Chitkara, Chandigarh or LPU university?",57,a year ago
Why Engineering from LPU?,40,a year ago
How are the placements of integrated ECE + MBA in LPU?,118,a year ago
"Which is a better university for B.Tech in CSE in terms of placement and education among Parul University, LPU and Medicaps, Indore?",670,a year ago
Does college go harsh on students with below 75% attendance?,10800,4 years ago
Can you share some more information about LPU? Is it worth to pursue B.Tech honors? Is CSE branch good or not?,80,a year ago
"Is placement of Chitkara University better than Thapar University, CGC Landran, Chandigarh University and Lovely Professional University?",96,a year ago
"Which university is better for MBA in terms of placements, LPU or IMS Unison?",140,a year ago
How is LPU in terms of placement for MBA? Does it provide internships?,45,a year ago
What are the various sports offered in LPU?,337,a year ago
Should I join LPU for ECE?,15,a year ago
I want to do MBA? What is the admission procedure without giving CAT at LPU? I scored 60% in B.Com.,72,a year ago
Which one is better- PGDM from Jaipuria Institute of Management or MBA from Lovely Professional University?,93,a year ago
What is the college timings for Diploma CS branch in LPU?,121,a year ago
"Which institute is better amongst LPU, G. D. Goenka, BML Munjal and CU?",298,a year ago
Are the students pursuing B.Tech CSE from LPU getting good packages?,163,a year ago
I want some reviews about the dual degree BCA-MCA course from Lovely Professional University.,768,a year ago
Does LPU offer MBA dual specialisation course?,1100,a year ago
Which one is good for B.Tech CSE LPU or HBTI?,372,a year ago
I have scored 95.4% in JEE Paper 2. Can I get a seat in LPU?,23,a year ago
How is LPU for B.Arch. How are the placements?,56,a year ago
"Which is a better college for B.Tech in CSE from among LPU, Veltech, BITS, VITEE, IIMT and all other private colleges?",44,a year ago
What is the fees and Eligibility for MBA from LPU?,63,a year ago
I want to take admission for B.Sc (Hons.) in Agriculture. Do I have to give entrance exam or direct admission on merit?,186,a year ago
How is the placement assistance in LPU for BCA course? What is the minimum salary package offered to the BCA students?,2000,a year ago
Are there any placements from LPU to other countries after M.Sc agriculture in agronomy?,336,a year ago
What is the package offered for mechanical engineers in LPU?,17,a year ago
Is LPU a good college for ECE engineering?,55,a year ago
"Should I take admission in LPU in IT stream? , is placement is good for IT branch?",267,a year ago
"Can I know which has better placements, LPU or CU?",93,a year ago
Is Lovely Professional University is good for B.Tech in CSE?,255,a year ago
How good are the agriculture courses from LPU?,83,a year ago
"Which university is better for CSE amongst LPU, SRM and CU?",708,a year ago
Does LPU provide any education loan assistance?,387,a year ago
Why is Lovely Professional University considered the best private university?,25,a year ago
Can I know which one is better: Punjab University vs Lovely Professional University (BBA-MBA)?,25,a year ago
"Which college is good among PEC University, LPU, CU and CGC? What is the rank of these colleges?",154,a year ago
How is LPU for research?,95,a year ago
Should I go for LPU for CSE or go for any other college as I have heard a lot of rumors about it? But LPU has a good placement record.,61,a year ago
Can you suggest a good university for computer Science engineering?,41,a year ago
Is it compulsory to appear for CAT/MAT/GMAT to get admission in LPU?,599,a year ago
"Which one is better for CSE among MS Engineering College, Bangalore and LPU?",164,a year ago
Is it a good choice to pursue petroleum engineering from LPU or should I look for other colleges?,35,a year ago
Which one should I prefer for a hotel management course: LPU or Army Institute of Hotel Management and Catering Technology and why?,189,a year ago
Why LPU is not AICTE approved?,107,a year ago
Which university is better among LPU and Vignan University?,494,a year ago
"Which university is best for pharmacy, LPU or CU?",143,a year ago
Can I get admission in B.Sc (Hons. ) zoology now? I have passed my +2 CBSE with 91% marks.,40,a year ago
How is the engineering campus of LPU especially for aerospace engineering?,162,a year ago
Can I know which is good Chandigarh University or Lovely Professional University?,11,a year ago
"I want to study B.Tech CSE. Which college is better for Good placement to me"" LPU or SASTRA UNIVERSITY""?",117,a year ago
"Which university is best, LPU or DITU?",331,a year ago
Can you suggest me which university should I choose for BCA LPU or Amity?,76,a year ago
Am I eligible to pursue M.Sc in biotechnology after completing B.Sc nursing?,467,a year ago
What is the highest salary package for M.Sc. Fashion designing students from lpu.,52,a year ago
How is LPU for Zoology course?,98,a year ago
Which one is better for BBA programme Galgotias University or Lovely Professional University.,69,a year ago
Which one is good among LPU and DY Patil University?,1200,a year ago
I want to join LPU for B.Tech (civil engg) but I am confused as someone told me that it is not AICTE approved.,210,a year ago
How is LPU for B.Sc agriculture?,200,a year ago
"Which university is better for an MCA degree among GNDU, LPU, Chitkara, or Chandigarh University?",53,a year ago
What is the syllabus for 1st year of B.Sc. Agriculture honors?,61,a year ago
"Which is better, Symbiosis Institute of Technology Pune, LPU, or Chitkara for B.Tech in CSE?",129,a year ago
Why would LPU be considered for engineering graduates.,60,a year ago
Can I know what is the ranking of the Lovely Professional University?,12,a year ago
Which is better for B.Tech in CSE: LPU or JECRC?,63,a year ago
"Which university is better for civil engineering among Chandigarh University and DAV University, Jalandhar?",23,a year ago
Is LPU good for distance education for MBA in operation management?,141,a year ago
Is internship provided in LPU for BBA (Hons. ). During the course period?,48,a year ago
MBA In lpu fees & Averege package in financial marketing.,172,a year ago
What is the admission process of LPU and the fee?,62,a year ago
Why MBA Hons programme is residential at LPU. I live in Jalandhar.,45,a year ago
"How are the placements in Lovely Professional University, Admission Office for B.Tech chemical engineering?",172,a year ago
What shall I do? I have taken admission for CSE in LPU and I am watching some bad reviews regarding its faculty and placement.,255,a year ago
"Which college is better for CSE among Galgotias, Graphic Era and LPU?",31,a year ago
What is the scope after B.Pharma?,717,a year ago
Can I get admission in Lovely Professional University or SRM or any other good colleges? My marks only 26 in JEE and 85% in board.,61,a year ago
Which is best for B.Tech CSE: Thapar University or LPU? Which will provide better scholarship?,66,a year ago
"Which college is better for BBA amongst LPU, JECRC, Prestige-Indore, Birla-Jaipur and Amity-Jaipur?",437,a year ago
Kl or lpu which is best.,49,a year ago
